y***叶,2017-03-04 17:03:14,目前我就用了一天  三月一号买的 三号到的 到了之后我就开机只要七秒 然后我又下了鲁大师 看硬件 到官网去查保修，是正品无疑，这个本我觉得同价位是性价比最高的了 ，客服的服务也很好 惠普真的做的很到位，我第一台电脑就是惠普的 比较喜欢 这次看了很多牌子后还是选择了惠普 ，但是跑分只有七万多 也不知道为什么 不过机子确实不错 还有我的机子 左边那里 圈出来的合的不是很完美右边比较好 客服说不影响使用那就没事了，我第二次开机九秒 第三次八秒 ，下了飞车之后重启了一下说32秒 不知道是不是加上了关机的时间了呢，  目前还是很好的 到时候有什么问题在评价！ 建议大家买个固态加机械的会好点 内存大 我是补差价买的240G固态的。客服很棒。！！！
盗***宸,2017-03-04 16:39:21,说是官方标配，其实是有改装的，系统还原依然用不了，去售后维修还需要申请光盘，悲剧啊
许***下,2017-03-04 13:02:54,鲁大师6万多一点，玩游戏运行声音有一点点大，整体还不错，头一天下单第二天就少一百，so sad_(：з)&ang;)_
r***5,2017-03-04 12:22:59,很漂亮，质量绝对保证，给弟弟买的，他用的很开心
李***s,2017-03-04 11:38:42,开机快，用设计软件都没问题哦
郭***0,2017-03-03 22:33:56,电脑不错，玩游戏也不卡，当然了，一分价钱一分货，这个价位的就不错了，好评。
泼***雅,2017-03-03 22:13:20,客服都好好，某只我想吐槽一下但是算了，工作都不容易，如果下次客户询问时直接告诉解决办法而不是让客户盲目的试就好了，送的鼠标很劣质，如果需要鼠标的还是自己购买比较好。另外，惠普是我的爱，性价比还有质感真的好。希望继续保持这种贴心。自带麦音质还没试，听歌倒是不错的，运行速度也很快，没有噪音，满意。
y***0,2017-03-03 21:51:07,系统不是很好用！
c***5,2017-03-03 20:53:55,看起来还不错，挺轻薄的。。。
旭***具,2017-03-03 18:42:45,卖家人很好，办事妥当，物流也行   最重要的是售后服务很好。
刘***3,2017-03-03 18:23:34,电脑用起来感觉不错，价格优惠，性价比高！
荔***学,2017-03-03 15:05:38,宝贝很好，物流也快。性能很溜，就等久验吧。本以为黑色不好看，不过细细品味也是不错的呢?。
1***h,2017-03-03 13:49:10,好评，绝对的好评，很有诚信，电脑也很好用，赠品也很喜欢。
爱***0,2017-03-03 13:14:13,客观评价，收到电脑这么久了，有几点不足，运行时有电流嗤嗤的声音，屏幕一般，可视角度差，开机时间一分多钟，其他基本满意，运行内存足够，处理器和显卡对于我这样不玩游戏的足够使用，期待本本能服役到我大学毕业。
心***横,2017-03-03 12:59:30,不错
易***落,2017-03-03 12:41:56,<b></b>此<b></b>用<b></b>户<b></b>没<b></b>有<b></b>填<b></b>写<b></b>评<b></b>论<b></b>!<b></b>
性***8,2017-03-03 10:25:56,电脑很棒，玩着放心。玩游戏不卡
南***妹,2017-03-03 00:59:39,电脑很好，lol   ps这些都带的动，一点都不卡，看电影电视更没问题，就是对于女孩子重了些  电池不够耐用，玩游戏一般两个多小时   看电影四个小时左右，客服很好 快递顺丰也快，机械键盘不会卡，一般谁便玩点游戏  修图  剪切视频  看电影  买官配挺好的，用了三天，挺不错，后续追加
你***哒,2017-03-03 00:35:37,暂时还都挺好的～ 以后再来追评啦啦啦
最***1,2017-03-02 23:28:53,9秒开机，速度很快，15.6寸，用起来很方便，屏幕很大，价钱合适，值得推荐
如***k,2017-03-02 22:34:26,特地用了几天才来评价。 先说服务吧，之前看评论，感觉服务态度蛮好的。没下单之前，咨询服务态度也不错。买了之后吧，怎么说，也不能说不好，但也不能说好。下单前备注说，希望能帮忙安装office软件，最好装在D盘，预安装的就算了，用不了多少天。客服说，可以帮装破解版，永久有效，结果拿到手，是预安装的，客服说，网上可以买到序列号，自己去搜然后再重新安装就好了&hellip;&hellip;总觉得有点被忽悠的感觉，当初你还不如说实话，只提供预安装的，没有破解版就好了，好过让我空欢喜一场&hellip;&hellip; 然后再说电脑吧。开机9秒，用鲁大师跑了个分，不高不低，感觉性能一般般。 再说使用体验吧。刚开始用的时候，不知道是我的网速慢还是电脑性能真的不好，一开始网页打不开，网速显示4-8M的下载速度，但是下载3个软件（搜狗浏览器、腾讯视频、暴风）从11点下到下午4点，我也是醉了&hellip;&hellip;联系客服，客服教我各种优化，但是感觉也没变快多少。有点小失望&hellip;&hellip;
回***留,2017-03-02 22:24:54,东西确实不错。。。性价比很高，就是屏幕清晰度不是很高，不过这价格也算值了
h***6,2017-03-02 20:14:34,用着感觉还可以！
来***嘻,2017-03-02 19:57:36,电脑一直玩，挺好的，客服也不错的
t***3,2017-03-02 17:31:50,这些时间用得还不错嗯。
落***1,2017-03-02 16:56:22,很棒的电脑  玩游戏一点也不卡  客服也很用心  很及时的回复我的问题  赞一个
l***5,2017-03-02 12:52:13,客服人很好，能很耐心的回答客户每一个问题，惠普这个品牌也信得过，电脑和图片相符，特别美观?，送的小礼物也很精美，但个人感觉白色款有点瓜皮?，推荐买其它颜色，但白色款的背光还是挺好看的，开机速度有灵性的人都懂(肯定是快)，认为我是刷单的，那你是愣头青，祝惠普生意兴隆
t***2,2017-03-02 12:03:22,东西还不错，就是还没有用哦，挺那么也没有贴。
w***6,2017-03-02 07:26:35,绝对的物超所值。不论玩游戏还是办公都挺实用的。
h***8,2017-03-02 06:20:36,总的来说还是挺好的，它的那个配置什么的我不懂，就是让我等地帮我选的吗？然后我用不打游戏的话就上班用一下，那个广联达软件还是挺可以的，就是那个显示屏分辨率有一点点差。
表***哒,2017-03-02 05:32:22,对于不玩游戏只办公的我来说还是不错的，很喜欢，宝贝一到就直接拿来写毕业报告了
怪***i,2017-03-01 22:46:20,用了几天了 还是不错的！
金***n,2017-03-01 22:33:08,用了几天来评价，配置还不错。不玩游戏，平时工作用足够了。送了包鼠，不用额外买了。
8***d,2017-03-01 21:11:52,宝贝试用了感觉超值，客服也很热心，快递大赞?，很不错的一次购物体验
