为***松,2017-03-12 22:57:56,挑了很久才才挑到这款的，同学也有人正好用这款，所以就买了，说出来你可能不相信，昨天买今天就到了，物流不是一般的快，拿到了赶紧打开看了下，简单设置后开机十秒左右，没有他们说的六七秒可能是因为我没加硬盘吧，就会一个英雄联盟游戏，下了这个游戏，完全没有问题。很棒，先使用几天再看看。
j***4,2017-03-12 22:39:26,新电脑，一大片手指纹印，还驱动装不全就出货？能不能专业点
张***r,2017-03-12 22:13:49,在网上选了很久最终选择华硕的，性价比高，很适合我这种学生党，而且最最重要的是我喜欢客服的表情包。态度也超级好，在买来开机的过程中一直在问客服各种问题，客服也在耐心的回答，很赞很赞的，希望以后电脑用着更好，很满意的，喜欢的赶紧拍吧。
l***2,2017-03-12 22:09:46,电脑很给力 顺丰很给力 发货第二天一个老早 我正要出门上班就先送过来了 电脑加了配置 所以没要我自己注册 开机特别快 想试试玩lol发现登录不进去 客服很认真的为我解答 设置电脑 解决了问题 谢谢客服 必须给个好评
可***7,2017-03-12 22:03:27,先说外观吧，作为外貌协会的一员，又对白色有点偏执的我，这款电脑真的很漂亮；因为是学生党，教科书后面很多光盘所以需要光驱，加之我最近挺穷的所以没装固态硬盘；关于性能：我是电脑小白我不懂，某娱乐大师只出了七万多的跑分，但是我试过开高配玩天刀，在场景是人少的郊外能跑得起来，但一人多，即使只是开极简人物也有点&ldquo;摩擦摩擦&rdquo;；然后说一点不解的地方，刚拿到电脑时用某娱乐大师看了看，硬盘使用次数23次使用时间8小时，下图是我玩了大概20小时？左右时显示的使用时间 关于物流：很快很好；关于客服：以辣辣为首的几个客服都很好，不厌其烦解答我那些明显有些无脑的问题很感谢（说得太多了谢谢大家?）
说***丶,2017-03-12 21:50:12,很好的，颜色也挺好看的，开机很快，7秒
1***龙,2017-03-12 21:35:20,第一次在网上买这么贵的东西，一直很忐忑&hellip;&hellip;收到后正好不在家，老公签收的，这几天忙一直没有确认收货，今天才想起来，抱歉，挺好的，10的系统公司也在用，所以比较顺手，目前一切都好，买牌子是有保证的！
杨***x,2017-03-12 20:29:02,电脑很不错 很轻巧也很方便 加装了固态硬盘以后，运行速度也很快，6 7s就开机了，  店家和客服的服务态度也非常好，物流也很不错，第二天就到了，还送了鼠标和电脑袋，手提袋。。要注意好好使用。。。?购物节买的，也很划算了
s***g,2017-03-12 20:23:23,电脑收到了，感觉非常不错。和之前的那台比起来有天壤之别。开机速度非常快，外观和性能非常满意，只是办公使用，完全够用。非常满意！
格***8,2017-03-12 19:54:38,试了几天，觉得非常好用，速度又快！
s***h,2017-03-12 19:48:59,电脑不是超薄的，有点厚重。已经换了SSD，但是第一次开机还是有点慢。
神***人,2017-03-12 19:00:53,还行，客服态度很好，物流很快的。电脑整体效果还行，?的
何***鑫,2017-03-12 16:55:15,还行吧，还在用，有有问题再说
爱***6,2017-03-12 16:53:12,还行，我只是用来刷课的，开机一般都是15秒。。。
a***8,2017-03-12 16:25:16,差评！服务态度很差！物流慢
黄***7,2017-03-12 16:24:31,首先感谢客服小晴耐心的解答，快递到货很快，由于期间换货了一次所以到现在才收货，其次顺丰的速度真不是盖的，打开电脑是要注意的事项，记住不要先连接WIFI这样会让第一次开机非常节约时间，要记住禁用自动更新系统，
w***3,2017-03-12 16:20:49,<b></b>此<b></b>用<b></b>户<b></b>没<b></b>有<b></b>填<b></b>写<b></b>评<b></b>论<b></b>!<b></b>
阳***灵,2017-03-12 16:03:02,怎么说呢，蛮失望的。第一天用就死机，然后卡到不行。以为是网络问题，后来发现真的不是。
陆***1,2017-03-12 15:34:24,什么电脑，不玩游戏都不行，老是死机，修电脑的叫了2个人都说电脑有问题，就是卡。退货又在推，什么态度，我要投诉！
从***起,2017-03-12 15:24:12,<b></b>此<b></b>用<b></b>户<b></b>没<b></b>有<b></b>填<b></b>写<b></b>评<b></b>论<b></b>!<b></b>
x***舞,2017-03-12 15:07:10,开机14秒左右，运行速度很快，太专业的方面我也不懂。不过色彩对比度不行，太素太淡了，还有送的鼠标也不好用，长时间不用重新关上再打开也不行，只能把usb插头拔了重插。鲁大师跑分8万多，客服很耐心，office 2016就是激活有点麻烦，但是很好用。电脑性价比很高，适合学生党。
熊***l,2017-03-12 14:17:20,好看，颜色正，漂亮的不要不要的，物流也快的飞起，第一天男票给安装了游戏，玩了一下午，一点都不卡，超级喜欢～
a***1,2017-03-11 21:06:51,到手十来天了，总体来说性价比还是可以的，CAD什么的完全无障碍，系统用起来还不太顺手，要是能提前帮忙分好区就更好了
j***贝,2017-03-11 20:42:12,电脑女生用有点偏大，不算重，开机要几十秒，30秒左右，而且我用的也不多，电脑总会有吱吱吱的声音，不知道怎么回事？？？能给我个答案吗？
t***7,2017-03-11 20:14:25,首先包装完好 顺丰还算给力 电脑外观完好 运行还算平顺 买来就是外出携带的 送了无线鼠标 电脑包还有键盘保护套 第一次开机 怎么也摁不开 插上电源 再摁 开了 升了级 安了常用的软件 还不错 还好 自助下单的
z***6,2017-03-11 20:11:14,本人已经买过的笔记本都是华硕的，就看中了这个品牌有着制造电脑主板的历史，所以质量过硬。从商务办公的角度来看，这款笔记本绰绰有余。其次，硬盘确实运行速度快。开机速度能够维持在6&mdash;11秒之间。良好的散热情况也是华硕的一大优点，在不玩游戏的前提下，温度基本没什么改变。综合考量，这个价格能够提供这样的配置已经很好，更不用说轻薄的设计与优雅的外观设计
t***4,2017-03-11 19:57:18,比想象中的好  另加购了120g的固态硬盘  商家还给安了word2010  学生党用起来还不错 还送了跨包 鼠标和键盘膜 快递也快  刚开始拍了  商品一直在揽件中  便截图问客服  客服也耐心的说了  是因为在加装固态硬盘 总的来说还不错
q***9,2017-03-11 19:17:26,电脑给衣服买的，用着挺不错，外观漂亮，日常办公用足以胜任。还是在搞活动的时候买的，商家还送了不少东西，挺不错的笔记本电脑，你值得拥有！
阿***物,2017-03-11 19:08:33,第一次再天猫买这种贵重物品，本着富贵险中求的心态去买的，还好没有让我失望，在白色金色之间纠结了很久，最后是客服给了建议买了白色，白色适合各种场合，刚拿到手就打了官方电话验是正品，店家送的赠品也是好的没的说，都是华硕的，第三次开机花了11秒，鲁大师测了一下八万五，性价比还不错，快递三天就到了，发货挺及时的
p***w,2017-03-11 19:06:20,挺满意的，而且还很划算，过年前就一直想买了，现在终于到手了，物流也挺快的。
y***1,2017-03-11 18:53:40,此用户没有填写评论!
弗***森,2017-03-11 18:49:30,不太懂电脑过一段时间
苏***7,2017-03-11 18:18:11,总体感觉还不错，外观就像之前看到的评论，没有那么亮，但是也很好看。客服的态度也很好，一直知道我使用。开机速度快，新机子只有一个盘，按照客服指导我已经分好盘了。驱动我已经试过了，是好的。运行速度可以。唯一就是视频不是很清晰，我还没有调节好。我不玩游戏，不知道会不会卡顿，但是看视频不卡顿。送的赠品都是可以用的，质量不错。
唯***d,2017-03-11 17:38:59,电脑这家只得信赖,之前表哥来买过两次，宝贝收到后特别满意，客服也特别有耐心呢，真的很赞，目前没发现电脑什么问题噢，金色感觉很赞，喜欢的友友可以买金色，别犹豫哦！！！
无***芬,2017-03-11 16:51:16,用了两天才来评价，电脑看起来还可以，我买的是金色的，总体来说很不错。一开始不会用鼠标，客服很耐心的回答，实时在线回答我的问题，首先得给客服姐姐五颗星。但是，我现在觉得电脑开机很慢，一分多钟，然后运行也很慢，不知道是不是我没装固态盘的原因，反应有点慢。不过，还是很推荐大家买的。
停***艺,2017-03-11 16:46:43,电脑小白一个，不怎么懂电脑。收到机子后不懂的询问客服都耐心解答～态度很好。电脑也很漂亮。挺满意的。
萌***a,2017-03-11 16:45:50,首先服务态度满分！！！ 要指名表扬客服【小晴】和【天云】*?(???`?)?*教我开机优化啊  分盘优化啊什么的   花费了很长时间  但他们两个都是有问必答  很耐心  一点一点地教我  很棒！！！ 这款电脑挑了蛮久   女王节下单便宜了一百多吧   选了金色款  但其实吧  它金色金得不太明显&hellip;&hellip;(?˙▽˙?)第一眼看过去   我以为是银色呢   细看还好   外观还是挺精致的   送了一个电脑包  噫  味道臭臭的???( ˊ?ˋ )???   一个无线鼠标  一张键盘膜   还有一张好丑好丑的黑了吧唧的鼠标垫   欸   然后是电脑性能   开机很快  大概10秒钟吧   只有独显   前天下视频一直下不了 还以为是电脑有问题呀  没想到磨了一天才知道是不支持下原声日语版的&hellip;&hellip; 客服还建议我配个固态硬盘就更好了～～～这个以后再说呗  其他的东西我也不太懂&hellip;&hellip;反正目前用了几天觉得蛮好  就是win10系统用得不太顺手啊！ 大体上都挺满意的哇   以后有什么问题再拿到店里去看吧～
o***b,2017-03-11 16:10:51,我买的是华硕A456U，加装了固态硬盘，用了三周再来评价。我是做机械设计的，需要做立体三维动图，三维图动态运行很考验机子，而这台机子用起来一点都不卡顿，动画效果很好。商家服务也到位，有问必答。
y***2,2017-03-11 15:52:42,经过长时间的选择，选择这款。物流还可以，宇航客服非常亲切，不懂的都给与了回复。大学期间够用了。非常满意的一次购物。
夜***0,2017-03-11 15:48:07,首先，先表白客服小何同学，很有耐心哟，我废话较多，电脑小白一个还手贱。电脑也很好用哟，我当初选择华硕就是因为他散热比较好，用了一个星期了对于散热也是比较满意的。买的时候看评论说开机卡，不能吧，我怎么不觉得啊，速度是不会让你久等的那种。反正，大家都是消费者，所以有什么感受都真实的分享给别人多好。再次表白小何，说不定我还会手贱虐待我的电脑，靠你解救了。 好好好好好好好好好好好好好好好好好好好好好好好好好好好好好好好好好好好好好好好好好好好好好
路***树,2017-03-11 15:39:01,电脑用了一段时间才来评价的，觉得华硕性价比也很高的。而且金色限量版很好看，还是金属外壳。配置摆在那，不会卡顿，用起来很流畅，开机几秒钟就搞定，非常满意。身边的同学都在用华硕，都说很不错，果然还得自己亲身体验才知道的确如别人说的那样。不错，我喜欢。客服也很认真的回答呢，耐心的为我解决问题，给五星好评！
c***y,2017-03-11 15:02:35,我一直在纠结，毕竟电脑这东西太贵，然而，客服服务好，同学也允许我买这个，我也喜欢，所以啊，还是不错的，就是觉得小了点，还好当初没买13.3寸的，本想加配置的，但我对电脑需求不大，所以没加，标配应该够用了，开心?
