雨***a,2017-03-16 16:23:25,跟描述的一样
w***6,2017-02-15 09:29:58,物流第二天早上就送到了，本本各方都不错，8G内存，256G固态盘～速度快?
花***熙,2017-02-14 22:01:42,电脑真的很好，是正品，有OFFICE学生版，挺不错的，颜值也不错，好评，就是赠品还有没发过来的，有点失望?
清***0,2017-02-14 18:30:40,一直不敢在天猫买这么贵的东西，不过买回来后，挺好的，是正品。服务态度也很好，有问必答，是个好店。电脑我也很满意。价格也很实惠。确实不错。最后申明不是拖
l***r,2017-02-14 18:01:10,是集成显卡不是独立显卡哦&hellip;售后服务很好，怎么问都不会觉得尴尬，柠檬大哥很棒，点个赞。
4***a,2017-02-14 16:21:16,这款笔记本稍微有点贵，不过颜值确实可以。
4***g,2017-02-14 14:25:05,开机很快，性价比高颜值也高，快递也快
孩***你,2017-02-14 13:32:15,外观很惊艳，薄，屏幕大，清晰，系统没太搞定，用起来了比较闷，客服很好，问题都能得到很好的解决
准***雨,2017-02-14 12:22:04,电脑不错，挺满意的，客服会说话，用用看吧，唯一遗憾让送的屏幕膜送小了
l***7,2017-02-14 12:18:20,很好的电脑，是我想要的，老婆很喜欢。
爷***呀,2017-02-14 11:55:19,颜值高，做工不错，但是键盘辣鸡，低端键盘，散热并不好，屏幕素质还行，最低端的ips也比那些垃圾tn屏好，这个电脑适合影音娱乐和一些轻量级的网游，或者是一些商务办公人员，其实我是没钱才买的，预算够的话推荐去买xps15。店家服务态度相当nice
胡***w,2017-02-12 19:07:14,顺丰速运真快，下单后很快就到了，包装很细心，送的东西挺不错，使用了几天，对于不玩游戏的，感觉很不错，外形惊艳，大屏轻薄便携，开机和打开软件的速度都很快，win10系统还需适应，其他都很满意，客服也是有问必答，很周到，很满意
饭***b,2017-02-12 12:48:23,价格真是没得说性价比高
y***4,2017-02-12 09:43:29,还没用，物流快，先好评！
q***定,2017-02-11 18:56:24,服务不错！第一次买电脑，高兴！
爱***你,2017-02-11 17:56:38,这是一次完美的购物，买之前还担心会不会买到假货，但收到货以后这些顾忌就烟消云散了。电脑很好看，开机也很快，赠品都很不错，和描述的完全相同。
遇***人,2017-02-11 15:25:18,还行吧，目前来看还是不错的
将***料,2017-02-11 12:45:09,东西棒棒的
b***a,2017-02-10 23:36:58,电池续航撑死也就两个小时！充电器三次也就一次好使，要反复的弄！按键区特别松动！显然是组装机！这还敢充正品！假期出门没时间退货，回来过了七天不退！而且说送耳麦！回头送个破耳机还跟我咬文嚼字！送的什么破鼠标破音箱！根本就不好使，low的不能再low了！举报是肯定会举报你家的！最差的一次淘宝购物！
j***1,2017-02-10 23:30:33,我觉得这个还是可以的，燃7000我也很满意，以后换电脑还会来看看的。
冷***星,2017-02-10 21:54:52,电脑还是不错，只是有时候莫名其妙的卡死机了  不知道是怎么回事。打lol  fps110左右
读***笑,2017-02-10 19:31:57,电脑今天刚试了试，电脑超级美，用着也比较顺手，现在很满意，等用一段时间再来追加吧?
i***你,2017-02-10 01:08:20,先说说优点，外观漂亮，手感好(键盘除外)，仅用于办公影音等用途时运行流畅，反应速度快，就这个价位的本本算是性价比比较高的了！ 再说缺点吧，首先得吐槽下送的配件了，简直不堪入目，什么单肩挎包，音响呀我不想说了,这种货色也送得出手！再就是电脑本身了，仅用几小时在激活office时，就啸叫死机一次，希望后面不会再出现了；键盘太水了，我是在群光电子做过笔记本键盘的，做工不咋地，成本价就二三十块；核显居然是HD610,不是620吗？；最后还有轻微的吱吱声，可能是正常现象吧！ 总体来说还好吧，就这个预算，入手这样的本办公学习是一个不错选择！游戏什么的还是远机械师之类的吧。
t***1,2017-02-09 18:20:09,<b></b>此<b></b>用<b></b>户<b></b>没<b></b>有<b></b>填<b></b>写<b></b>评<b></b>论<b></b>!<b></b>
柚***夏,2017-02-08 23:12:47,用起来还可以，开机很快，但某些时候开机进入会跳不出来输入密码的界面，会卡住，但不会太久，不要紧。不过有时候微信啊或者网易云啊会卡住，无响应。我也没有开很多软件什么的，也没有装游戏。就这样吧，总的来说挺好的。希望能坚持久一点。
l***1,2017-02-07 17:45:56,<b></b>此<b></b>用<b></b>户<b></b>没<b></b>有<b></b>填<b></b>写<b></b>评<b></b>论<b></b>!<b></b>
s***8,2017-02-07 17:23:56,本子不错，很喜欢
a***4,2017-02-07 12:48:49,可以
南***2,2017-02-07 10:48:23,电脑速度可以，售后服务很好。
逗***4,2017-02-06 11:11:27,店家客服是真的可以，我骂他他都不还口。果断给好评。机子还在用，一段时间后再发个追评???
关***察,2017-02-06 09:48:42,刚刚到手的电脑，颜值没得说，第一次在网上买那么贵的东西，店家服务很好，电脑的质量还没有时，不过应该不错
