萧***7,2017-03-16 17:15:40,电脑小白一个，客服很负责，机子还不错
t***1,2017-03-16 14:24:55,还不错
嘟***逗,2017-03-16 12:27:09,就是开机比较慢 然后反应也不这么快   整体还可以吧
l***9,2017-03-16 12:20:01,反应速度太慢了、有点老牛拉破车的感觉
h***7,2017-03-16 10:59:05,正版Win10,开机快！手感很好！屏幕够大好有高大上的感觉。难怪我女儿一看见就说帅了！也谢谢客服的耐心指导，因为我本人问题比多?。总的来说机子是不错的?
只***j,2017-03-16 10:55:10,物流速度超快的，很喜欢戴尔这个系列的超薄本，外出携带很方便，性价比和造型都还可以，挺不错的～
t***1,2017-03-16 07:48:37,昨天刚回来，总体来说还是好的，到是开机速度有点慢，有点小发热，运行速度也不是太快，不过学生用还是差不多的
z***0,2017-03-16 00:59:26,说的超薄，结果买来一看，很厚差不多有3公分左右了，这也叫超薄。本以为没有驱动刘很薄，结果一看只是驱动不能用而已。厚度还在。无语了，等了5天才到。
卢***呆,2017-03-15 22:49:04,电脑很好，客服服务业很到位，物流比想象的晚了一点，但是对快递人员的态度感到很满意，好评！至于电脑方面，我并不怎么了解就简单说一些吧。运行速度挺快，现在也就用了两三天也并不卡顿，挺感谢客服，帮助我解决了一些问题，开机嘛现在一般十几秒，最近两次一次16秒一次12秒，感觉还可以。
莹***9,2017-03-15 21:55:58,开机有点慢，一开始有点问题，问客服，客服帮我弄了，态度很好
h***人,2017-03-15 15:56:24,这款原装键盘不好用，送的鼠标也不好用
甜***蔽,2017-03-15 14:35:12,还不错，客服真的很耐心，晚上很晚了还在帮我弄office, 赞一个！
喂***吗,2017-03-15 13:52:01,不错，不错，不错
z***7,2017-03-15 08:41:17,东西收到，很满意!!真的是超级好的卖家，解答疑问不厌其烦，细致认真，关键是东西好，而且货物发得超快，包装仔细，值得信赖!
m***4,2017-03-14 22:32:24,电脑一开始没有安装系统，之后我在客服的细心教导下我顺利安装成功了，14寸的用起来刚刚好，方便携带。电脑画面也挺清晰的
w***2,2017-03-14 16:44:09,这个牌子的电脑一直在用，质量非常不错，几年没出一点问题，刚开始以为i5会比较慢，没想到这个电脑玩游戏一点都不慢，开机十秒左右，卖家装的内存和固态硬盘都不错，是品牌的，再一个就是电脑的外观非常平整，看起来很舒服，拿在手里很有份量，足以说明电脑真材实料。另外客服小伟的服务态度也很好，问了很多都耐心地给予解答。
d***5,2017-03-14 15:40:21,宝贝早就收到了，之所以等一段时间在评论也是对买电脑的负责啊，虽说快递第二天就到，我也想观察一段时间再评价，没想到这电脑还是值得购买的。再说说这标配吧，运行还可以，画三维也不卡，值得入手。&ldquo;小伟&rdquo;很负责.
辉***5,2017-03-14 10:31:14,宝贝非常好用  颜色很好看  客服也非常耐心  满分
2***7,2017-03-14 10:03:11,东西很不错，外观十分可以，很商务，办公完全无压力，就是不知道游戏怎么样，反正要求不高，能撸就好，物流也挺给力的，顺丰保价，安全快捷，点个赞！！！
a***a,2017-03-14 08:50:24,电脑是用了快一个月后才来评价的，没有出现任何质量问题，运行速度还是杠杠滴！套餐四比较划算，性价比高，加固态后太好用了，哈哈。客服小兮的服务态度特别好，必须表扬一下，以后再采购电脑就认定你们店了。 很顺利的一次购物
萧***7,2017-03-16 17:15:40,电脑小白一个，客服很负责，机子还不错
t***1,2017-03-16 14:24:55,还不错
嘟***逗,2017-03-16 12:27:09,就是开机比较慢 然后反应也不这么快   整体还可以吧
l***9,2017-03-16 12:20:01,反应速度太慢了、有点老牛拉破车的感觉
h***7,2017-03-16 10:59:05,正版Win10,开机快！手感很好！屏幕够大好有高大上的感觉。难怪我女儿一看见就说帅了！也谢谢客服的耐心指导，因为我本人问题比多?。总的来说机子是不错的?
只***j,2017-03-16 10:55:10,物流速度超快的，很喜欢戴尔这个系列的超薄本，外出携带很方便，性价比和造型都还可以，挺不错的～
t***1,2017-03-16 07:48:37,昨天刚回来，总体来说还是好的，到是开机速度有点慢，有点小发热，运行速度也不是太快，不过学生用还是差不多的
z***0,2017-03-16 00:59:26,说的超薄，结果买来一看，很厚差不多有3公分左右了，这也叫超薄。本以为没有驱动刘很薄，结果一看只是驱动不能用而已。厚度还在。无语了，等了5天才到。
卢***呆,2017-03-15 22:49:04,电脑很好，客服服务业很到位，物流比想象的晚了一点，但是对快递人员的态度感到很满意，好评！至于电脑方面，我并不怎么了解就简单说一些吧。运行速度挺快，现在也就用了两三天也并不卡顿，挺感谢客服，帮助我解决了一些问题，开机嘛现在一般十几秒，最近两次一次16秒一次12秒，感觉还可以。
莹***9,2017-03-15 21:55:58,开机有点慢，一开始有点问题，问客服，客服帮我弄了，态度很好
h***人,2017-03-15 15:56:24,这款原装键盘不好用，送的鼠标也不好用
甜***蔽,2017-03-15 14:35:12,还不错，客服真的很耐心，晚上很晚了还在帮我弄office, 赞一个！
喂***吗,2017-03-15 13:52:01,不错，不错，不错
z***7,2017-03-15 08:41:17,东西收到，很满意!!真的是超级好的卖家，解答疑问不厌其烦，细致认真，关键是东西好，而且货物发得超快，包装仔细，值得信赖!
m***4,2017-03-14 22:32:24,电脑一开始没有安装系统，之后我在客服的细心教导下我顺利安装成功了，14寸的用起来刚刚好，方便携带。电脑画面也挺清晰的
w***2,2017-03-14 16:44:09,这个牌子的电脑一直在用，质量非常不错，几年没出一点问题，刚开始以为i5会比较慢，没想到这个电脑玩游戏一点都不慢，开机十秒左右，卖家装的内存和固态硬盘都不错，是品牌的，再一个就是电脑的外观非常平整，看起来很舒服，拿在手里很有份量，足以说明电脑真材实料。另外客服小伟的服务态度也很好，问了很多都耐心地给予解答。
d***5,2017-03-14 15:40:21,宝贝早就收到了，之所以等一段时间在评论也是对买电脑的负责啊，虽说快递第二天就到，我也想观察一段时间再评价，没想到这电脑还是值得购买的。再说说这标配吧，运行还可以，画三维也不卡，值得入手。&ldquo;小伟&rdquo;很负责.
辉***5,2017-03-14 10:31:14,宝贝非常好用  颜色很好看  客服也非常耐心  满分
2***7,2017-03-14 10:03:11,东西很不错，外观十分可以，很商务，办公完全无压力，就是不知道游戏怎么样，反正要求不高，能撸就好，物流也挺给力的，顺丰保价，安全快捷，点个赞！！！
a***a,2017-03-14 08:50:24,电脑是用了快一个月后才来评价的，没有出现任何质量问题，运行速度还是杠杠滴！套餐四比较划算，性价比高，加固态后太好用了，哈哈。客服小兮的服务态度特别好，必须表扬一下，以后再采购电脑就认定你们店了。 很顺利的一次购物
t***9,2017-03-13 22:45:49,物流速度真快，颜色也很喜欢。就是玩大型游戏有点小卡，这个价位的还不错的
o***o,2017-03-13 22:03:02,总体感觉还行吧。就是搞不明白，又没有网络，整体的话还算不错，感谢客服小丽的耐心解答有好多都不懂，慢慢来吧，不行买个网卡试试。用一段时间再来评论
怒***颜,2017-03-13 15:32:55,第一次买电脑没经验，是寝室的同学帮忙看的，好用，开机特别快，服务态度也特别好，值得购买
小***3,2017-03-13 15:28:49,一般般
t***1,2017-03-13 11:03:48,电脑收到已经使用了几天，首先来说物流很快，也很负责，包装完美，没有任何磕碰，其实电脑我买了最高买的最高套餐，内存8g好流畅，不小心忘记密码导致需要重新电脑还原，感谢客服小伟一步一步的帮忙，还有office没了，也是他给我发送安装包指导我完成，很感谢
o***8,2017-03-12 18:09:15,戴尔的这款机子很久之前就想入了，最开始的时候是我弟弟推荐的，但是一直没有找到机会。幸运的是这次团让我下定了决心。这店的商品质量一流，快递速度很快，昨天下单的今天下午就到了，而且客服（小丽）的服务态度非常棒，可以看出是确确实实为我们这些客户考虑的，话不多说，好评五星送上?
t***2,2017-03-12 10:40:26,360显示的开机时间居然要4分30秒以上
1***心,2017-03-11 20:18:45,第一次在网上买电脑这样贵重的东西，刚刚拿到手，什么都不懂，全靠客户小兮和小丽的耐心指导说明才让我慢慢上手，教会了我很多东西，关键是服务态度好，又耐心，什么注意事项也说的很清楚，电脑的款式和颜色我也很满意！大赞！
落***比,2017-03-11 20:09:38,我是一个学生党，在大学课程用的比较多，但这款电脑首先来说外观就很时尚很好看，关键是性能不错，我拍的带固态硬盘的电脑飞快，客服小丽态度很好，很耐心的介绍，肯定是个大美女?很满意的一次购物
兰***格,2017-03-11 12:01:01,电脑优化后开机都在十几秒左右，外表漂亮，关注了之后还送电脑包、鼠标、鼠标垫等等。客服小丽也很有耐心，我很多不懂的在晚上问她，她也很快速地回答我。
h***5,2017-03-11 10:00:42,本来是想华硕笔记本的，后来继续寻找，看到了这款想同配置的电脑，无论如何戴尔笔记本是国际顶级品牌，所以就决定买这款电脑。虽然其外表没华硕笔记本漂亮，但我追求的是实践出真理。
长***偶,2017-03-10 20:55:06,电脑还好吧，就是感觉太男性化了，昨晚才开始用，目前也不清楚有啥问题，不过客服态度不错，就是物流太慢了，还是顺丰，三四天了才收到货
8***科,2017-03-10 13:47:42,电脑很好，特别是店员小丽服务态度也很好！特别感谢小丽的耐心讲解！
x***3,2017-03-10 10:07:03,还好吧，没怎么用，系统不太习惯用
s***0,2017-03-10 06:58:23,一般
增***唧,2017-03-09 13:35:08,屏幕太小 外观挺好看
s***0,2017-03-09 11:18:38,在你家买的第六台了 相当不错 感谢客服小伟 挺为客户考虑的  如果客服都和小伟一样好沟通 以后公司电脑就长期在你家购买了 总之 电脑就一个字 值！祝卖家生意兴隆！
t***2,2017-03-09 08:10:45,电脑外观观很漂亮，加了固态之后反应超级快，公司很满意，很值得拥有。以后还会再来购买。
伊***店,2017-03-08 17:34:23,很好
y***n,2017-03-08 16:54:06,客服小兮态度很好。电脑性能也不错。价格也不是很贵。开机速度挺快的。
h***6,2017-03-08 15:15:12,电脑收到了，产品包装完好无损，顺丰的小哥也是很负责，帮忙打开验货，确认无误才走，卖家赠送了包鼠垫，电脑全新未拆封，开机速度也比较快，很满意，对于电脑小白的我一次次的让客服小兮和小丽帮忙解决遇到的任何问题，不论何时，她们都不厌其烦，耐心热情，真的要给个大大的赞
淡***定,2017-03-08 14:42:52,系统感觉很纯净 还有就是客服也很用心  小夕 和小丽 大半夜质询都有人回答
l***g,2017-03-08 14:10:40,目前仅用来办公，感觉还可以。但偶尔会有点卡，游戏完全不能够。
史***m,2017-03-08 14:03:55,用了几天才来评价，电脑很不错，一点都不卡，本来还担心连不上校园edu，没想到连上后网速还挺好！
w***2,2017-03-07 21:28:02,特意用了3天才来评价。个人感觉是款性价比很高的电脑，我是用于工作方面较多，正版win10、独立显卡高大上，屏幕也挺大，手感挺舒服，赠品不错。买的是银色的，颜值高。客服对于我不间断的问题也很有耐心，感谢你们的帮助。
8***y,2017-03-07 21:10:09,总体来说还是还好的，学生弄弄软件打打联盟可以的，就是不是超薄，比图片厚多了，物流也蛮不错的，可以入手
b***者,2017-03-07 19:57:31,我实话实说啊，电脑刚买来开qq转圈～我能理解这是因为系统没有优化，然后鲁大师评测电池损耗百分之五我能理解这是因为鲁大师本身不是专业的软件，然后一个卖电脑的我媳妇朋友告诉我线下实体店这款卖3799多然后我上京东也是这个价～我第一次发现原来实体店比线上便宜，太坑了你们想买的话随意
有***了,2017-03-07 18:53:07,客服服务不好，少发一张键盘膜，反馈后没有给到满意答复，更未致歉和补发，性能待观察。
l***1,2017-03-07 17:00:18,此用户没有填写评论!
i***7,2017-03-07 15:00:27,新电脑开机会卡 不知道为啥
s***0,2017-03-07 13:11:34,这台电脑性能符合价格 配置也适合办公所需 外观不错 很骚包 小妹妹很喜欢 又买了一台 卖家也很负责 总之一个字 赞！希望店家生意兴隆！
岁***1,2017-03-07 12:42:17,在买之前犹豫了很长时间最后还是选择了这台电脑，还好没让我失望，戴尔的性价比还是挺高的，机子外观非常漂亮不厚携带也十分方便，客服小兮和小丽非常有耐心。
距***y,2017-03-07 12:00:11,昨天拿到的，感觉跑分也还行。整个外观感觉很靓 开机速度很快，买来就是为了打打游戏的，下载后试了一下感觉不错，打LOL截图如下 fps挺好的 总体感觉挺好的 接下来继续用着看
c***3,2017-03-07 08:55:56,给女儿的礼物，刚下单就迫不及待的等着，一天问好几遍，终于到了，女儿爱不释手。外包装完好，颜色是她想要的颜色，卖家还赠了包、鼠标、垫、键盘膜，需要买的都省了。DELL这款笔记本性价比还是很高的。等用段时间再升级固态硬盘，速度会更快。
8***科,2017-03-06 22:49:58,经常来买，服务态度很好，
愿***画,2017-03-06 20:49:08,开机速度慢，还很卡，不咋的好
相***妥,2017-03-06 19:36:15,用了几天电脑还可以,玩英雄联盟有点点卡。
h***5,2017-03-06 19:15:40,这是第一次买电脑，没什么经验。就听我爸爸说戴尔的电脑不错，于是就给弟弟买了一台，弟弟收到后，他非常的喜欢。他同学也都说不错。
沧***7,2017-03-06 18:18:16,早就听说戴尔电脑不错，这次是买给妹妹的，她收到用到现在评价说不管是外观，配置，质量和售后服务都不错，听说在国外 除了HP 就算 DELL了，国际一流品牌，非常值得购买哦！！！！
w***0,2017-03-06 17:18:52,外形时尚，耐看。机身材质是镁铝合金+复合材料。耐用，兼容性好，不过该款电脑散热性不是很好，戴尔电脑在游戏测评中结果很好，很不错的一款电脑
u***0,2017-03-06 14:11:29,宝贝很不错 ，物流很快 ，到货后迫不及待拿快递拆箱了，还是很满意的。因为是第一次买电脑，很多东西不懂，但是客服很有耐心的帮助我解决问题了，给客服和宝贝点个赞！
吴***0,2017-03-06 10:44:22,客服小兮的水平很高,人也很有耐心,看到好多买家的评价都给的很高,没想到真的是这样的.像这样的卖家,在网上已经很少见了.我问过好多卖家了,都不能做到的,卖家MM都做到了.而且价格也低.真的好开心啊. 卖家服务好，价格公道~!哈哈，不谦虚了，想看更多，就来吧，好了，不浪费你的时间了，加油!!!!
t***司,2017-03-06 10:43:10,开机速度还是比较快的只要13秒左右，运行速度还可以。另外，收到电脑第二天就降价了，后面把差价退给我了，这点很不错！ 小兮客服服务不错，比较热心，有问必答。
流***艳,2017-03-06 00:40:48,做工不错，暂时没出现什么问题，只有机械硬盘的噪音有点尖锐
h***孩,2017-03-05 23:18:44,这款电脑性价比挺好的，配置也很不错，卖家送的东西很实用，用了几天，总的感觉很棒！就是没我想象中的薄，有一点点失落，但颜色和图片上的一样很漂亮，客服小丽也很敬业，随时为我解惑，很耐心
数***7,2017-03-05 14:54:06,买来好多东西不懂问客服，态度不好，物流很慢六天才到的，电脑目前没什么问题，我是学生，买来看看电视做ppt之类的，开机很快，感觉还不错。
骑***了,2017-03-05 14:07:37,买了以后，很快就到货了。到货以后，发现有一点卡，所以就询问了客服，客服给我热心的回复。用了一个周以后，又来评价的。负责任的告诉大家，这个价位得到这笔记本，肯定是值得购买的。大家可以相信我哟，希望大家工作顺利，老板生意兴隆！当然也祝福我学习顺利，顺利考博成功！
老***i,2017-03-05 10:19:06,宝贝早就收到了，之所以等一段时间在评论也是对买电脑的负责啊，虽说快递三四天到的，确实也是因为我在北京，地理位置有点远。再说说这标配吧，运行还可以，如果不玩守望先锋还行，平常打撸没问题，值得入手
赵***2,2017-03-05 09:32:54,试用了五天才来评价，电脑特背流畅，开机10秒内，加固态和8g内存用起来特背爽，办公娱乐完全足够，而且很漂亮，客服小丽服务态度好，一直很有耐心，很愉快的购物体验，会推荐给同学.
莫***q,2017-03-04 21:40:50,快递很快，前一天发货，第二天就到了，发的顺丰。电脑也很好，颜值高，质量好，卖家还送了鼠标，键盘膜，电脑包。包装严实，很喜欢。
h***8,2017-03-04 21:19:16,首先感谢客服&ldquo;小兮&rdquo;耐心的回答。机器包装很好，双层纸箱，顺丰快递超快。机器自带win10，office。，i5-7300的速度很快。3个usb，1个hdmi。因为想要带光驱的，找了很久才找到这款，同事很满意。
阿***3,2017-03-04 18:38:19,比想象中的重，其他的再看看吧
陶***啊,2017-03-04 14:10:31,还可以啦
二***爵,2017-03-04 11:39:45,我是菜鸟，不太懂，但是同学都说好用，还可以的哦
郭***生,2017-03-04 05:36:21,在外表！和使用真的不错，使用一段时间再回来?
w***y,2017-03-03 22:16:34,试用了一周，暂时没什么发现有什么问题
随***0,2017-03-03 19:50:28,第一次在网上买电脑，发货速度快，二天多就到了，拿到电脑开机速度快，上网运转正常，看视频不卡，充满电看视频差不多用了三小时，给儿子买的，他很满意
t***0,2017-03-03 19:08:37,玫红色很正，搭配黑色很独特，外观超赞的说，戴尔这款不错~
海***5,2017-03-03 18:48:42,不错！很喜欢！用着很顺手！
g***2,2017-03-03 15:30:21,质量好 适合学生党的使用 网速不卡 使用起来方便快捷 ?反正我十分喜欢 孩子也很喜欢 货美价廉  值得我们使用??
难***7,2017-03-03 12:42:43,买了快两周才来评价，顺丰快递不错，一直让人放心，笔记本也不错，样子好看，然后用的也不错，游戏也没有卡，带光驱很方便，学生党很受益，客服小丽也很棒，细心回答我的问题，就是散热声音我不太喜欢。其他都还不错。
信***9,2017-03-02 22:46:42,宝贝收到了,与描述的相符,外观漂亮,配置高,试用了一段时间,感觉CPU运行速度快,内存容量大,在电脑上运行视频处理的大型软件速度快,商家诚信,客服服务热情,是一次满意的购物,用后再来追加好评. 服务满意.
会***去,2017-03-02 22:32:18,刚开始看的时候感觉这款机子外观不错，到了后感觉不错，银白色的看起来很美观，到了之后玩了几天英雄联盟没有出现卡顿的现象，运行很流畅，很满意
小***暑,2017-03-02 16:04:17,哎呀电脑还不错啦，虽然价格有点小贵，但是配置不错噢，刚开始拍错了，现在拍的是套餐一，内存也是杠杠的，虽然有点厚，但是一点都不重，不过我要说的一个问题就是啊，套餐一其实是有光驱的，不过也蛮好的，刚好拿来看我珍藏多年的吉他教程，电脑有点小烫，不过开机蛮快的，哎呀呀客服真的是很可爱，还跟我斗图来着??好想把客服带回家噢。
青***离,2017-03-02 14:17:51,用了一礼拜没有发现啥问题，挺好的^&omega;^
向***上,2017-03-02 13:19:30,<b></b>此<b></b>用<b></b>户<b></b>没<b></b>有<b></b>填<b></b>写<b></b>评<b></b>论<b></b>!<b></b>
我***吧,2017-03-02 12:48:44,我已经买了大半个月了，用得还是挺得心应手的。外国很漂亮，开机很快，物流也很给力。要想买的同志们可以放心购买哟。棒棒哒，点赞哟。看图吧
可***勉,2017-03-02 12:41:02,物流用的是顺丰，非常快，大概一天就到了～电脑的颜值还是很高的，拿在手里也不显得笨重，内存升8G还加了固态硬盘之后开机关机速度飞快，只要11s！触板很灵敏，续航应该有两三个小时。客服小兮、小丽和小罗都很有耐心，而且回复很及时，态度很好，让我拥有了一次愉快的网购体验??
e***敏,2017-03-02 11:37:29,此用户没有填写评论!
h***g,2017-03-02 10:32:23,看了很久最后才在朋友推荐下选择了戴尔，不算轻薄，但是主要是放在办公室用来办公用的，所以没有太大问题，喜欢外壳的金属质感，喜欢磨砂高清显示屏，加了固态硬盘，所以运行真的很快。客服小兮人很好，都有很耐心积极地帮忙解答疑问。好评，会推荐给有需要的朋友。但是希望发货可以快一些。
x***n,2017-03-02 09:25:12,刚买回来的电池，写着剩余电池两小时多，用了不到半小时，就没电了，配的鼠标和包包也是很垃圾，要不是过了七天退货时间，我肯定要是退回去的 服务跟辣鸡一样，就会一句话：你已经过了七天，退不了货了，哈哈。老子真想抽死你！
c***6,2017-03-02 07:45:11,这个电脑用到目前来说还算不错，因为购买的是套餐二，所以收到电脑时就可以用了。不用我自己再去安装系统什么的。用鲁大师跑了8000多分，开机10秒左右，运行速度不错，很快的。也很认真的检查了电脑，没什么问题。唯一让我感到不适应的就是电脑的屏。哦，对了还有鼠标，比较难按，鼠标垫臭臭的，好几天味道还在。
时***z,2017-03-01 22:12:24,电脑收到了，用着还不错，开机很给力，我也是纠结了很久，收到货，才发现选择是对的，客服服务态度也很好，有什么问题都会一一解答，有喜欢的可以下手了
g***4,2017-03-01 21:56:10,发货速度慢，整整5天之后才发货。但是客服小兮服务态度相当不错哦，有什么问题都找她，都能很耐心解答。电脑用了几天才来评价的，值得推荐
于***u,2017-03-01 20:58:30,电脑还挺不错，用了好几天才来评价的。重量适合，性能不错，还有电脑包，鼠标鼠标垫和在实体店买的带的东西差不多但是价钱缺便宜。客服服务也不错，目前只有office没有成功激活了，后续会联系客服激活的???
w***i,2017-03-01 18:11:20,性价比特别好的一款宝贝！包装好！还送了键盘膜和电脑包。性能稳定。客服小兮服务热情周到。耐心解答。
l***0,2017-03-01 10:04:47,电脑拿到手，很漂亮也很好用，散热很好，而且一点声音都没有，开机很快，非常满意的一次购物，后续会继续追评
宝***竹,2017-03-01 09:37:34,买的套餐三，开关机很快，颜色很漂亮，总体来说还是满意的。
w***3,2017-03-01 08:44:24,作为名就读学生，选这样的电脑配置已经很不错了，的确可以运行大型游戏，卡不卡，那就得看网速了，据客服说可以自己改win7,这就看个人喜好了，总得来说感觉还可以，可以推荐一下
j***0,2017-03-01 00:12:28,以前就是用的戴尔，质量一直很好，这次又选择DELL，质量没的说，工艺考究，样子漂亮，这次单加了硬件，运行速度快，性能稳定，感谢小丽周到的服务，，
a***r,2017-02-28 23:14:41,金属质感很强，不是很沉，很薄，办公用的好本子，而且很多人都用戴尔，小巧精致，好评。配置不高，不过价位在这，办公绰绰有余，游戏就算了吧，虽能玩，配置要求不够会伤电脑的。觉得有用请赞一个。
s***8,2017-02-28 22:14:22,<b></b>此<b></b>用<b></b>户<b></b>没<b></b>有<b></b>填<b></b>写<b></b>评<b></b>论<b></b>!<b></b>
l***7,2017-02-28 21:50:06,宝贝很满意，小巧轻盈，携带方便，开机和网速都挺快的，最主要是客服都很有责任心因我没说清楚发票开成了普通，跟客服沟通后马上帮我解决了问题。值得我给全5分。
林***8,2017-02-28 21:07:37,送货速度如空运，质量等用试试后在评论吧，客服态度很好，有耐心，好评
万***哥,2017-02-28 21:00:05,客服小罗的态度很好，服务很热情
t***2,2017-02-28 20:18:49,电脑外观不错 收到后充了电马上试用了一下 手感也很好 用了半个月吧 没有出现问题 每天都是正常的办公 偶尔玩玩游戏 很满意的一次购物
