柔***童,2017-02-28 19:51:41,用软件测了一下，应有的配置，不过好像散热不咋地啊，笔记本很好
教***的,2017-02-28 18:53:38,下午收到的电脑，打开，非常好，开机速度很快，软件远行速度不错，而且电脑的外观颜色我也挺满意，我给朋友看了一下，都说的挺值的啊，我真心感觉非常好
猫***m,2017-02-28 14:07:36,本来收藏了好久才决定买什么颜色，孔雀蓝真的好好看，超喜欢这个颜色。我对电子产品之类的东西可谓是一窍不通，所以对系统方面我也不知道怎么去评价，总之用的很顺手，呵呵。。客服都特别有耐心，小丽、小罗还有小兮。因为我上晚班，将近11点了还耐心的回答我的问题，简直太敬业。
回***教,2017-02-28 12:47:59,电脑不错   本来买了有点卡 后来问了一下客服小丽 原来是要优化一下系统  然后按照步奏优化一下之后 电脑就用起来快了 外观蛮好看的 也比较轻和小巧 配置也很好  感谢客服小丽的帮助
夏***苒,2017-02-28 10:31:19,外观挺好看的  客服服务态度很好  就是电脑开机的速度有点慢  现在用了还没有什么问题
珍***7,2017-02-27 21:47:06,用了两天才来评价的，电脑还可以，我以前用的是华硕，第一次买戴尔，只用于办公不玩游戏，我还加了4g的内存条，运行起来还行，不算很卡，毕竟我是运行大型软件。表扬一下客服态度很好，尽管中间有点插曲，但是老板态度很好，很快解决了，值得信任的商家。好评
北***长,2017-02-27 20:53:19,不管是哪个客服人都很好 因为每次电脑都是待揽收的时候我都去找客服去烦他们 不过他们都没有说很生气不理我（虽然有时候会）但是还是要表白客服嗯就酱 电脑&hellip;一个小白也不知道说些什么好就那样吧厚死了
f***2,2017-02-27 20:21:10,电脑到了，特地试了两天才来评价的，感觉还不错的，就是感觉触摸屏的缝隙有点大了，不是太满意。但是客服小兮的服务态度好好，快递也很快。
m***杨,2017-02-27 19:41:03,<b></b>此<b></b>用<b></b>户<b></b>没<b></b>有<b></b>填<b></b>写<b></b>评<b></b>论<b></b>!<b></b>
h***0,2017-02-27 17:25:20,运行速度快，外形很漂亮，正品，很是喜欢 客服小丽服务热情，服务到位
吴***啦,2017-02-27 17:08:45,首先我觉得最棒的是快递，超级快，前天晚上买的，马上发货，今天下午就到了。第二就是客服，有问题找他回的很快，也很耐心。关注后就送了电脑包，鼠标，鼠标垫，键盘保护膜，一个不差。然后比较差的就是开机没有介绍中的快，有点卡，可能是我没优化的原因。其他情况等我用了再来评价。
t***1,2017-02-27 14:15:06,顺丰快递送到门口的都是，太骚了超喜欢，还没有装系统，等用了再来追加评论，推荐购买
启***翔,2017-02-27 13:51:20,很满意的一次购物，快递速度很快，电脑与描述的一样，试用了一下，电脑速度非常快，反应很灵敏，开机速度也很快，最主要的是客服非常给力，很有耐心和责任心，问了很多问题都细心的给讲解了，强烈推荐这家店！
阿***1,2017-02-27 13:39:00,<b></b>有<b></b>点<b></b>卡<b></b>
咱***衰,2017-02-27 12:04:09,用着还行，感觉像素不是很好，然后屏幕也不怎么样
g***9,2017-02-27 10:50:23,电脑几天前就拿到了，因为换货出了一点小插曲，但是不得不说客服的态度真心好，顺丰速运也是快，第一天拍的第二天就到了，电脑是我喜欢的样式，也非常薄便于携带，运行速度非常快，完全满足办公需要，也非常适合学生党哦！推荐购买，性价比相当可以，比在实体店买不知道便宜多少呢！能满足日常的工作和娱乐需求，以后有需要还会光顾这家店的。 服务态度很好，有问题客服统统都给解决了！
安***丫,2017-02-27 10:40:03,很好 值得推荐！
雨***哥,2017-02-27 09:24:41,还行吧
m***0,2017-02-27 09:07:12,物流很恼火  其他还好
h***2,2017-02-27 08:40:43,送给自己的生日礼物，外观很不错，枚红色的，很美，刚到货几天，还没有认真使用，应该还不错的，之前客服小丽的服务挺不错的，都有及时答复，不玩大型游戏，办公用用挺好的。
天***丿,2017-02-26 22:09:14,电脑很快就到手上了，宝贝外观还是不错的，平时不用于打游戏，用于办公还是很实用的，客服小丽也很赞，第一次用win10系统不知道怎么弄，细心指导后很快就上手了，这次购物还是挺满意的，
t***6,2017-02-26 20:49:54,我是通过一个有购机经验的朋友那里介绍才买这台电脑的，感觉自己买的价位挺值的。下单才过一天，就收到自己心爱的电脑啦??，真的好快啊，8核运存，真的够我用的了，真的挺满意的
s***2,2017-02-26 20:13:26,<b></b>此<b></b>用<b></b>户<b></b>没<b></b>有<b></b>填<b></b>写<b></b>评<b></b>论<b></b>!<b></b>
秋***9,2017-02-26 17:51:24,网上看了好久，最后还是选择了这家，正好赶上活动优惠百元，物流信息显示慢了，客服小丽不厌其烦的解释，货到后孩子说还不错，只是空格键那儿有点翘，不过不影响使用，开机十来秒，还行。
r***f,2017-02-26 17:20:37,物流简直不想说，比普通的快递都还要慢！东西还不错，就是有那么一点儿不顺手！有那么一点儿反应慢，还是挺不错，毕竟这个价位！
因***0,2017-02-26 14:10:15,电脑很喜欢
1***帅,2017-02-26 13:13:12,这个牌子一直都听人说不错的，很好。自己亲身体会了一次的确不赖。希望买电脑了好好权衡一下。这个电脑真心不错。大家多支持支持。真的很好。谢谢卖家服务态度很好。
开***者,2017-02-26 11:27:52,电脑还好，就是发票寄错了，最后却是我自己承担邮费
牟***3,2017-02-26 10:04:54,还行
e***9,2017-02-26 09:51:25,使用起来还不错 ，开机蛮快的 ，只是电脑虽然薄，还是很重，比预期的重了很多。店主发货很快，只是物流不给力，用了六天才到, 比预期的慢。
一***8,2017-02-25 23:40:09,非常棒，兑现承诺，物有所值
f***j,2017-02-25 19:36:54,货已收到，暂时未发现问题。客服态度很好，解决问题的速度也很快。
银***雨,2017-02-25 15:15:27,还好
y***i,2017-02-25 11:48:05,用了几天才来评价的，也查询了下本本是正品 加装了固态速度更快了 声音没有了
l***1,2017-02-24 22:41:05,电脑用着特别好，漂亮大方，图片晚上拍的不是很清楚，物美价廉。做兼职用的美美的。开机十秒钟。很是值得购买的一款。
随***1,2017-02-24 21:25:31,产品很好，用的很快，好用
c***g,2017-02-24 20:09:08,上午顺丰快递小哥把电脑送到家里来了，由于是第一次在网上买这么贵的东西，所以要当着快递小哥的面把包装拆开，包装特别严实，打开一看颜色特别漂亮，送的电脑包等东西也很好，送走快递小哥就迫不及待的接上电源试了一下，开机速度特别快，等我下载完喜欢的软件再来继续分享。
董***勇,2017-02-24 16:22:13,前两天收到的，刚刚拿到的时候感觉好沉，打开手感不错，玩着也挺舒服的，看电影也特别清晰，虽然有点小问题，但是已经解决了，不耽误正常使用！ 挺好
没***头,2017-02-24 15:59:40,怎么买来就卡卡的 反正偶尔点了半天都不理我 为何新电脑就这么慢吞吞
t***7,2017-02-24 15:08:21,电脑今天刚到啦  就赶紧打开来看了 开机速度真是快到飞起  很好看 卖家送的各种配件也很齐全  有发票有保修单  很好的
萧***n,2017-02-24 14:10:03,电脑很漂亮～电脑速度也很快，物流比同期一起买电脑的同学要快一点点～客服真的很耐心！一款很适合学生的电脑，配置也可以的。性价比很高哦！期待以后的效果嘻嘻！送的小东西也很好！祝生意兴隆哦！
乌***y,2017-02-24 12:21:12,电脑现在用的感觉还不错，刚来的时候打不开机，以为坏了 原来要用力点按开机键才行，不懂电脑，反正只要不卡就行。小兮和小丽客服不错，服务态度很好，因为不懂所以问了很多很有耐心。看主页图片上的颜色觉得粉色和蓝色很丑，看了买家秀才买的红色，比图片颜色好看多了，实物颜色更好看。用一段时间在看看，到时候再来追评。
江***哼,2017-02-24 01:47:54,喜欢喜欢 也很满意 物流飞一般 第一次大物件 在网上买  没有选择错 客服也很耐心的教我 因为我真的很笨
c***羊,2017-02-23 22:20:48,颜值高，哈哈，都还是不错
原***c,2017-02-23 19:17:51,此用户没有填写评论!
三***日,2017-02-23 15:57:08,不错，正品，帮朋友买的，速度挺快，很好看，也很好用。
t***惫,2017-02-23 14:03:25,电脑拿到了，第一次商家忘记给我装内存了，服务很好，让我马上寄回去，给我装了4g的内存，第二天就寄回来了，顺丰快递很快，服务也很棒，然后马上打开看，装了4g的金士顿，售后文杰技术服务不错哦～虽说内存有8g但是似乎玩游戏还是有点不够，不知道是不是网速度不够。电脑配置还可以，比之前的华硕棒哦～外观也大气。给弟弟，学生用用还可以，薄薄的方便带～
黑***1,2017-02-23 11:44:46,做工很好，最新款的，处理器最新款7代，机子是去年10月份上市的，一手机，从第一次必须得充电才能开机看出来，win10系统，保修24个月，屏幕很漂亮，配置中高断，打lol足够，2g独显属于中高端，价格因为是新型机，也差不多，没有被坑，具体还得看后续使用过程看看会不会出现什么情况，目前还可以。好评！！ 打英雄联盟不卡，开机10秒左右，运行速度快。 每次询问问题，客服都非常及时的为我解决，教我怎么做，很感谢！谢谢客服小丽和小兮 的耐心解答，戴尔恩荣真心不错的哦，
在***密,2017-02-22 17:31:41,快递非常快，一天就到了，包装的很好没有一点损坏，客服很有耐心，问的问题都会解答，电脑用了一天感觉很好，卖家还送了好多东西
t***3,2017-02-22 14:18:08,第一次在网上买电子类产品，一开始有点怕网上买的会跟实体店差异很多，收到货很开心，跟实体店一模一样，很惊喜，也很喜欢，客服也很耐心也很及时回复问题
t***7,2017-02-22 14:03:12,昨晚就到了，开机使用了一下，感觉很棒，总之物美价廉。这两天课好多，来不及详细评论。本着对大家负责的态度，待我用一两个星期再来补充。大家多看看那个问一问的部分，自然心里有底，光看评论没太多用处。希望大家能买到合适的电脑，也祝卖家生意兴隆。图片等稍后回宿舍补上。
c***3,2017-02-22 10:10:55,<b></b>此<b></b>用<b></b>户<b></b>没<b></b>有<b></b>填<b></b>写<b></b>评<b></b>论<b></b>!<b></b>
美***红,2017-02-22 10:09:34,还没有用多久，目前没有什么问题，开机好快，款式也蛮好看的。
快***成,2017-02-22 08:31:07,总体还行，续航能力太差。
