低***y,2017-02-25 01:00:21,物流很快，宝贝颜色粉粉的，挺轻的，很喜欢，开机速度非常快！卖家态度不够好啊！赠品缩水
s***停,2017-02-25 00:09:04,电脑很棒，有好多赠品，银色的很好看，试了一下速度挺快的，总之满意啦。
t***5,2017-02-24 20:58:34,喜欢，发货好快，感谢快递小哥，全五分
胡***亮,2017-02-24 18:52:53,东西收到了，开箱后才发现里面有一处破损，提醒所有买家，一定要注意验收，因为快递一走，东西你就退不掉了！
y***u,2017-02-24 13:35:06,粉色很喜欢，买的最高配置的，试用了几天，机子反应很快，还没有发现问题，感觉不错哦，好评！
看***烫,2017-02-24 01:47:58,超级棒的，物流很快，粉色滴很漂亮，我有很多不会。客服都很耐心！！！人超级好！嘻嘻满分
o***o,2017-02-23 17:09:42,发货速度太慢，物流也不是很给力，电脑运行速度一般。
荷***5,2017-02-23 16:33:15,电脑很好啊，在网上挑了好久，才决定好买这个类型的。敬业的店家还附送电脑包，鼠标等等，挺满意！！！
m***y,2017-02-23 16:26:52,收到开始有点小曲折，虽然原来想要i7六代的因为有高分屏，但是现在换成了i7七代也没什么的，不过有点卡，不知道是不是电脑问题，总体来说还是很不错的。送的东西挺多，只是电脑包大了。
d***生,2017-02-23 16:09:18,首先说一句超级喜欢!特别适合小女生用，看了很多家店都没喜欢的本本，就这款让我一眼相中哈哈哈哈！买电脑就要买一个自己喜欢的嘛，用着也舒服呀！目前没有出现任何不满意的地方，而且联想在中国也算是个好牌子了!
z***2,2017-02-23 09:05:03,电脑已经收到了，外观非常漂亮，机子超薄很轻，就是win10系统操纵起来还不是很习惯
c***蜜,2017-02-22 21:15:12,嗯嗯，外观超级漂亮，虽然物流很让人伤神，但是等待来的却也是惊喜了，很好看，很喜欢这个有颜值的电脑。
x***1,2017-02-22 21:07:26,货已收到，与描述相同。开机也挺快的，给女儿买的，颜色很好看，还有好多赠品。包装结实，收到时外箱一点未破损，保护得很好。电脑也很轻，便于携带。但物流不太给力，其实已经发出来几天了，查不到物流信息，害得我天天提醒发货。快送货时物流信息一下全出来了，给我一个惊喜。总体来说是满意的一次购物体验。 希望物流信息能及时更新
e***2,2017-02-22 16:26:15,用了几天。很不错。真的很轻便。开机速度很快，电脑运行的时候几乎听不到任何声音，难得会有卡塔一下的声音，是风扇吗？性能很好。180度旋转！挺牛逼的！
w***8,2017-02-22 08:10:51,各方面还可以
怡***哦,2017-02-21 19:09:47,本本真的不错 适合女生用 挺好用的 客服也很好 特别耐心 刚拿到手不会客服很细心的教了
淡***l,2017-02-21 19:02:00,电脑开机快，最主要的是颜值高呀，喜欢上面刻的玫瑰花，还有送的小萌鸡?也很可爱
董***8,2017-02-21 16:53:59,外观与图片一致，挺好看的，客服挺热情的，还有，今天买，第二天就到了。另外，卖家还送了一些配件
t***a,2017-02-21 15:55:10,电脑很好用，小巧精致！  硬件也很给力，I7处理器速度就是不一样 客户服务态度很好
陈***友,2017-02-21 09:23:30,粉色的超级好看，一拿到手上爱不释手，很轻薄，也赠送了很多东西，电脑包，鼠标，u盘等等，很喜欢。
二***贝,2017-02-21 08:45:11,我以为春节刚过快递会比较慢，没想到比平时还快了一点。电脑也很棒棒，基本没有问题，office2010下载时不会下，客服都帮忙给我找到网址。就是屏幕比想象的小了点，不过用着挺舒服的。送的东西也都很实用今年也正好鸡年。第一次网购这么贵的东西，很满意！！
久***0,2017-02-21 01:02:28,电脑不错 外形也挺好看的
s***h,2017-02-20 20:56:08,买回来的时候就迫不及待的拆了吧然后发现那个粉嫩的呢，很适合我也很喜欢，哦打开支用了一下发现机子还蛮好的，然后内存也蛮大，然后就是谢谢啦，习惯了然后就是过来点个好评。
w***3,2017-02-20 19:59:20,总体来说还是挺好的，虽然由于是核显，跑分上不去，但是玩一些主流3D网游还是可以，剑灵能开二档，用了几天还可以，没啥大毛病！
z***8,2017-02-20 11:47:36,粉色真是太好看了，开机速度和运行速度都很快。用了几天没毛病，很适合女孩子。上面的玫瑰花图案很喜欢哦！
杨***3,2017-02-20 10:43:21,送的音响，小巧可爱，同事喜欢，大小用着刚好，送的键盘保护膜大好多，鼠标垫和屏幕差不多，太大，果断剪成两半。
t***0,2017-02-19 18:51:06,和苹果比较的话还是有点慢
陌***r,2017-02-19 17:46:50,客服很耐心，电脑也很棒
半***她,2017-02-19 16:49:15,东西真不错，全给满分了，大爱！！！哈哈，1080p果然不一样，看着舒服多了。！！
幸***y,2017-02-19 07:55:54,用了几天了，好用，速度快，流畅的很，太好了
h***8,2017-02-18 21:31:30,东西很好，试用了以后觉得网速很快，颜色也漂亮，就是价格偏高，因为选择了升级的版本。很喜欢，然后觉得累的人辣么好，客服的态度也很好，各种耐心的解决问题。
霏***非,2017-02-18 16:02:02,漂亮游戏也能带起来，还给她贴了膜
烟***你,2017-02-18 14:11:44,快递是真心的快。电脑颜值真的很高  巨好看   我是很喜欢    特别适合女孩子用   喜欢
天***1,2017-02-18 10:10:41,卖家的服务态度很好，还挺细心，电脑颜色挺少女的哦，总体还是可以的。
p***w,2017-02-18 07:54:27,电脑运行速度快。轻便。卖家发货速度快，到货后咨询客服怎样恢复出厂设置等问题（后来发现说明书上有），客服态度好。满意。
z***3,2017-02-17 23:34:03,喜欢这款电脑很久了，一直犹豫在实体买还是网上，网上价格确实有优势，怕后续服务不如实体方便，结果担心完全多余，客服非常耐心解答疑问，并且帮我分区和优化，顺丰到手，开机确实是快呀，大家有需要就下手吧，漂亮，实用。卖家更是没话说，特好！
到***名,2017-02-17 23:01:23,我是不懂电脑的，但是，我弟弟玩得起英雄联盟，应该还可以的，也没什么问题，就是电脑里的应用商店不可以用。有点遗憾。电脑很漂亮，送了挺多东西。反正我喜欢。有问题再追评咯。
善***璐,2017-02-17 20:46:07,收到了，超级喜欢，外表高大上，还很入境，对电脑不了解，第一次买，各方面都挺奥力给的，挺不错的，适合女生，喜欢的宝贝抓紧买
y***8,2017-02-17 19:38:46,电脑收到了，真的很好，我很喜欢，颜色也很好看，配置非常好，希望亲们赶紧抢购吧，把握机会哦
l***7,2017-02-17 16:39:20,很好看，很实用，超喜欢
清***攸,2017-02-17 16:24:22,这款银色的好难买啊，还好买到了，送了一大堆东西，u盘鼠标键盘膜什么的，还有鸡年公仔?，开机设置完鲁大师测了下，硬件都是16年10月份的，确认新品无误。里面送的office是正版的，有序列号直接激活就可以用了。
l***l,2017-02-17 12:40:50,电脑外观很好看，轻巧，而且还有女生很喜欢的粉色，开机普遍第一次就是很慢，后面超级快，很好用，很喜欢，下次使用段时间在看，现在一切挺好。
w***5,2017-02-17 11:31:15,不好意思 试用了几天才来评价：包装很好，电脑轻便，外观漂亮，给我女儿买的，她挺喜欢，开机快，运行流畅，追剧三小时还不怎么打热，送的礼品 很实用 很不错，值得推荐！
星***离,2017-02-17 11:22:05,还不错，还没适应，不知道好不好用
米***刻,2017-02-17 10:50:15,我男朋友推荐的，说这款轻薄 七代I7 配置也不错，携带也非常方便，原本下单粉色的，客服说有白色的款式，且白色还有玫瑰花图案，果断换白色的了，收到了之后果然没有失望，可以说是惊喜，白色实物比粉色图片的要好看多了，玫瑰花的纹理也很清晰，看起来比较特别，带去公司同事也说颜色很搭，比较知性，另外客服服务比较周到全面，很实在为我考虑，客服很赞！
w***1,2017-02-17 00:01:20,特地试用了几天才来评价的，电脑电池很不耐用，充满电玩不了多久就没电了，其次是卖家的服务态度真的很差，第一次买东西买成这样，问什么东西也是爱搭不理的，东西没发出来也不说一声（但物流信息是显示发出来的），好像一副你爱要不要的，我既然买了你家东西就证明我有这个需求，不是说叫我退款就能解决这些问题，我的本意不是说买了就退款，你发顺丰3-4天都不到，我是不是得问下咧？最后还是我自己打去问的，一问卖家就说你申请退款吧，我也是醉了。。。。 非常差
t***1,2017-02-16 19:01:09,至少现在买着我是不后悔得，粉色也好看，同时很轻巧，这样是最好的。
李***9,2017-02-16 18:51:56,这个电脑还不错哦，给孩子买的 很满意，颜色也很好看 图案也很好看 关键是配置不错，虽然卖家可能忘记发键盘膜，还是不错的 希望大家手快 来买哦
c***h,2017-02-16 17:01:01,打开好慢不好用
