沫***实,2017-02-14 22:46:03,怎么说呢，电脑屏幕还行吧...顺丰速度很快，拿到后超级开心，打开一看，竟然连鼠标都没有，这就有点伤心了...还得再买..
二***叔,2017-02-14 21:07:29,用了几天才来评论 东西不错
t***2,2017-02-14 19:18:08,是朋友推荐买的，用了好多天了，还是很不错的，听朋友说适配器比以前要小多了，电脑整体做工也好了许多。话说没什么太高的要求就不需要加固态硬盘，运行起来还是蛮好的。快递是真快，客服态度也很好，总之，挺好的。
爱***了,2017-02-14 13:41:12,物流很快，开机还没跑分，在下游戏了，手感很舒服，选微星就是因为品质，总体来说很不错噢
甜***购,2017-02-14 12:28:55,性能不错，服务态度很好，收到了两天要来试试，所以现在才来评价，玩着不错
亡***2,2017-02-14 03:40:50,还行吧，但我想问一下说好的1t呢？！！结果内存只有914g，少了110g
出***始,2017-02-13 12:51:35,外形太帅了，第一眼就喜欢上了，不愧是微星。十分喜欢，软件方面还行
黑***子,2017-02-13 12:47:17,性能确实可以
c***宇,2017-02-13 10:02:45,电脑非常喜欢，客服服务态度也非常好，好评！
孤***2,2017-02-13 08:59:50,挺好的
小***x,2017-02-12 15:27:18,种种原因迟了几天确认收货，屏幕还可以，不是非得换，键盘手感算是惊喜，软啪啪的塑料在这个价位也过的去了，散热很棒就是声音挺大的，外放略渣，店家送了鼠标垫还有键盘膜，膜是扔了毕竟不想破坏手感，总的来说还是很满意的
t***3,2017-02-12 14:22:30,暂时感觉还不错
a***宝,2017-02-12 12:51:26,5星好评，你也不要问我为什么。
膜***菲,2017-02-12 12:38:23,第一次买微星的电脑 外观挺好看的朋友介绍的一直说参数非常厉害  挺好的
蒋***h,2017-02-12 10:52:29,东西不错 没啥问题
美***魅,2017-02-12 09:05:52,<b></b>此<b></b>用<b></b>户<b></b>没<b></b>有<b></b>填<b></b>写<b></b>评<b></b>论<b></b>!<b></b>
s***h,2017-02-12 00:28:24,还不错 。没啥毛病
a***4,2017-02-11 18:13:59,等了2天总算到了，龙骑士果然是种信仰，用了半天发现win10不太稳定有点小卡，娱乐大师16万。过几天玩玩游戏再追评
b***强,2017-02-11 15:38:38,还行吧，只不过玩游戏的时候声音有点响，屏幕也感觉怪怪的
s***r,2017-02-11 14:32:45,此用户没有填写评论!
安***帅,2017-02-11 14:15:24,昨晚到的，物流，客服都好的没话说。现在电脑也整好了。好评呦！！！
d***n,2017-02-11 11:44:49,非常好，儿子很喜欢。
s***3,2017-02-11 10:12:07,本来满开心的购物，可是这个售后简直无语，打电话电流和风扇声音大你们说是正常的也就算了，游戏颜色黑的什么都看不见了你们说游戏没设置好要么换游戏，然后其他游戏同样是这样你们就不理了，这也算是技术人员？
胖***情,2017-02-11 00:17:01,很不错哦，遗憾的是不是背光键盘
f***9,2017-02-10 18:51:05,东西很好，卖家也很好
霓***花,2017-02-10 16:08:21,目前用的还可以
t***2,2017-02-10 15:57:42,新机，正品。暂时没有发现大问题。比预期的轻，不知道是磁盘还是风扇有一点小杂音，可以接受。第二天发货，第三天到，顺丰依旧给力。
周***昊,2017-02-10 15:16:41,产品还是非常棒的。
c***2,2017-02-10 12:11:05,第一次买笔记本  感觉性价比不错  客服人很好
枪***y,2017-02-10 11:06:44,还不错，就是屏幕确实差了些，以后也得自己加个固态。
巴***v,2017-02-10 10:50:10,棒棒哒
北***眠,2017-02-09 22:10:35,我是电脑萌新，一直都是客服帮我解答问题的，很细心也很耐心。宝贝物流很快第三天就到了，跑分的话17万左右毕竟我没装固态，我主玩地下城和lol.地下城是120左右的fps   lol是160左右的fps  很给力大型游戏我还没试，等试了再追加吧。人懒就没拍图了，嘻嘻
小***彬,2017-02-09 18:35:22,像这个驱动人生图标显示不出来不知道什么原因，性价比还是不错的
s***贱,2017-02-09 12:26:31,第一次买电脑，感觉不怎么满意，首先只是个裸机，什么也没送，然后就是感觉电脑反应速度有点慢，不过总的来说还行
t***5,2017-02-09 09:22:24,感觉不错，刚开始有点小卡，然后好了，感觉还得加固态硬盘。雾面屏，不刺眼，但是并没有那么清晰，正面看不错，值得入手。
1***w,2017-02-08 20:09:35,电脑还可以 就是开始的时候玩守望先锋不知道怎么会事 FPS低得很 非常的卡 但是后面关机后 第二天来玩就很流畅 无压力 就是散热器的声音有点大
z***9,2017-02-08 20:02:44,第一次买这么好的电脑，先说一下感受吧 1.自带的软件实用，功能丰富 2.散热强悍，性能不错。玩巫师3高特效关闭抗锯齿和海飞丝有50帧，守望先锋高特效关闭抗锯齿稳定70帧，cpu和GPU只有60多度，还没有开一键强冷。 3.电脑本身的材质摸起来还可以，但就是容易留下一下痕迹(不知道是水印还是油印)，而且很难擦掉，这点很不爽。 4.键盘手感还不错，不过键盘的右边部分布局跟平时使用的键盘不一样，我打字的时候经常按错。 5.有时候有些地方还是挺慢的，至少不如我以前的超级本(没有固态，4g内存，低压i5)快，比如开机输入密码后登录时间偏长，我也不知道是什么问题，建议还是加个固态。 6.至于屏幕，屏幕我没检测，看评测好像是94%NTSC的tn屏(不知道有没有说错)，屏幕这种东西看情况，我经常玩osu和守望，tn屏对我来说还是有必要的(当然我也没用过IPS屏幕)。至于可视角，左右还行，上下不太好，但是我觉得没什么人会从比较高的地方低头看电脑屏幕 快递还是很给力的
尤***7,2017-02-08 14:57:37,我都不知道该怎么吹了，很赞
