y***g,2017-03-08 09:20:18,电脑不错，独显，固态+机械，大内存，能想到的都有了，价位这么合适，真是一款性价比超高的本子。虽然机身塑料，但是超薄，开了一晚上打补丁，机身一点也不热，散热值得赞。老板主动把win10替换成了win7，谢啦。
m***7,2017-03-08 00:26:54,物品与描述一致，高端大气上档次，快递给力，用了几天，开机速度很快，轻薄轻巧，方便携带，发热量小，静音，送的礼物挺多的，包装也挺严实， 真品无疑，物美价廉，手感和外观都很棒，卖家的态度很好。全5分好评！！！
刘***品,2017-03-07 20:54:59,此用户没有填写评论!
t***3,2017-03-07 20:32:06,还可以
韩***蒙,2017-03-07 19:30:14,开机只要十几秒，速度快，赠送的礼品鼠标，鼠标垫，电脑包，都很满意。不错的一次网购，朋友推荐的！！！
t***5,2017-03-07 18:51:23,电脑真心不错！ 用于游戏lol还会用于办公 设计方面！ 电脑运行不错 不卡 也挺薄得 值得我们拥有 正品联想笔记本值得一赞。 服务很好，很热请
z***3,2017-03-07 18:04:59,买的套餐一2899元，这用了几天才来评论的，还不错，外形挺漂亮的，全新正品，包装好，还送了电脑包，鼠标，键盘垫，清洗套装，7系统好用，开机速度快，
鸡***鸡,2017-03-07 17:56:52,开机挺快的，店家赠送的豪华礼包也特别多也很实用
逛***人,2017-03-07 17:53:36,物流速度很快，服务态度很好，电脑用着很顺手，速度也很流畅
依***涯,2017-03-07 15:33:09,服务态度说好也不算好，说坏也不算坏
样***哈,2017-03-07 14:52:16,还可以 物流速度很快 电脑挺好的 用起来很方便 玩游戏也不错 至于英雄联盟 也很流畅 值得广大撸友选择 推荐买套餐3以上的
