邹***1,2017-03-16 22:14:54,不错
2***物,2017-03-16 22:10:04,所购商品与描述在试用中有差距，待后还原。望后期服务跟上。
小***5,2017-03-16 17:59:06,宝贝已经收到用了几天才来评价的 感觉还不错 本来一直纠结在实体店买的 结果没让我失望
t***2,2017-03-16 17:49:00,dnf打团不行，其他可以
m***4,2017-03-16 17:37:47,刚买回来。还没用，用了再评价
l***1,2017-03-16 16:49:37,运行速度挺快的，看上去很大气！很满意
t***8,2017-03-16 15:26:47,收到货后我非常满意，宝贝跟卖家网页上描述的一样，超级精美。适用了半个月才来作评价，本子运行速度很快，性价比高。
毕***超,2017-03-16 14:09:40,此用户没有填写评论!
张***用,2017-03-16 13:39:03,朋友介绍买的，很好用，安装了几个游戏。一点也不卡。我们有几个朋友都是在这家店买的，
z***钱,2017-03-16 13:30:41,此用户没有填写评论!
d***物,2017-03-16 12:30:25,还好吧，用了那么多天，没发现什么不好的
a***3,2017-03-16 12:17:34,还好，用的顺手的。
r***0,2017-03-16 10:29:35,这个价位的电脑还是不错的，性价比在这个价位来说非常不错，值得购买！
沙***泥,2017-03-16 09:41:45,顺丰就是快，联想就是好。周日下单周三下午就到了，这可是大广东到吉林呀。这款电脑个人认为性价比很高，速度够快。售前售后服务都不错。发自内心的好评。
绸***f,2017-03-16 08:38:31,用了两天来的。首先，物流得赞，几个小时后就发货了，隔天也收到了。这电脑吧，拿到后第一感觉外观不错，跑分63000多点，性价比还好，是原装的，噪音在很静，时候有很轻微的，也正常。客服还可以，叫他预装软件的什么的帮搞了。配的东西里除了键盘膜有点不合适外其他还好。本人不玩大型网游，供看电影学习用，总体不错，建议入手
黄***天,2017-03-15 22:50:08,好评，用着还不错
t***8,2017-03-15 21:14:50,很轻外壳塑料的感觉不是太结实显卡是独显集成两G，速度还行，这个价也就这样吧
何***1,2017-03-15 19:42:27,物流很快，收到货试了一下，不错，这个价位的电脑也是物有所值吧！
贺***8,2017-03-15 19:35:52,电脑买来用了两天了，感觉很好，机器很薄，屏幕很大，很喜欢，我买的是套餐3，开机要20多秒，我是家里用用的，已经很好了。
h***5,2017-03-15 19:26:33,今天刚刚收到，很好，希望以后可以和卖家保持联系
邹***1,2017-03-16 22:14:54,不错
2***物,2017-03-16 22:10:04,所购商品与描述在试用中有差距，待后还原。望后期服务跟上。
小***5,2017-03-16 17:59:06,宝贝已经收到用了几天才来评价的 感觉还不错 本来一直纠结在实体店买的 结果没让我失望
t***2,2017-03-16 17:49:00,dnf打团不行，其他可以
m***4,2017-03-16 17:37:47,刚买回来。还没用，用了再评价
l***1,2017-03-16 16:49:37,运行速度挺快的，看上去很大气！很满意
t***8,2017-03-16 15:26:47,收到货后我非常满意，宝贝跟卖家网页上描述的一样，超级精美。适用了半个月才来作评价，本子运行速度很快，性价比高。
毕***超,2017-03-16 14:09:40,此用户没有填写评论!
张***用,2017-03-16 13:39:03,朋友介绍买的，很好用，安装了几个游戏。一点也不卡。我们有几个朋友都是在这家店买的，
z***钱,2017-03-16 13:30:41,此用户没有填写评论!
d***物,2017-03-16 12:30:25,还好吧，用了那么多天，没发现什么不好的
a***3,2017-03-16 12:17:34,还好，用的顺手的。
r***0,2017-03-16 10:29:35,这个价位的电脑还是不错的，性价比在这个价位来说非常不错，值得购买！
沙***泥,2017-03-16 09:41:45,顺丰就是快，联想就是好。周日下单周三下午就到了，这可是大广东到吉林呀。这款电脑个人认为性价比很高，速度够快。售前售后服务都不错。发自内心的好评。
绸***f,2017-03-16 08:38:31,用了两天来的。首先，物流得赞，几个小时后就发货了，隔天也收到了。这电脑吧，拿到后第一感觉外观不错，跑分63000多点，性价比还好，是原装的，噪音在很静，时候有很轻微的，也正常。客服还可以，叫他预装软件的什么的帮搞了。配的东西里除了键盘膜有点不合适外其他还好。本人不玩大型网游，供看电影学习用，总体不错，建议入手
黄***天,2017-03-15 22:50:08,好评，用着还不错
t***8,2017-03-15 21:14:50,很轻外壳塑料的感觉不是太结实显卡是独显集成两G，速度还行，这个价也就这样吧
何***1,2017-03-15 19:42:27,物流很快，收到货试了一下，不错，这个价位的电脑也是物有所值吧！
贺***8,2017-03-15 19:35:52,电脑买来用了两天了，感觉很好，机器很薄，屏幕很大，很喜欢，我买的是套餐3，开机要20多秒，我是家里用用的，已经很好了。
h***5,2017-03-15 19:26:33,今天刚刚收到，很好，希望以后可以和卖家保持联系
t***6,2017-03-15 18:35:17,电脑验证是正品   玩了几个游戏不卡很不错   开机速度也很快 同事们都说不错
l***7,2017-03-15 17:02:39,物真价实，木有骗仁！开机与描述无误！
潮***6,2017-03-15 16:55:15,机身很薄，外观很漂亮的一款笔记本电脑，配置也相当主流，预装了win10系统，学习办公玩游戏都绰绰有余，掌柜另外又加送电脑包，鼠标，鼠标垫，真是好，很高兴的一次购物，朋友买定会推荐
奇***伟,2017-03-15 16:55:13,嗯！很多天了！才来评价，我觉得我买的还是比较值得的!同样是联想电脑，我室友在实体店买着3700多，而我只买着3200元，比她的少几百元，虽然我不知道她的内存多大，但在网上买之前，我去实体店问过了！差不多型号的，4G内存，只有500的机械硬盘，也要3500元左右。而我买的这个8G内存，500机械硬盘+120的固态硬盘。我觉得还是比较值得的!而且店家人很好，帮我安装了我想要的软件。谢谢店家。
曾***6,2017-03-15 16:20:47,很快，很好，物流很快，质量很好。服务很好。
天***销,2017-03-15 16:14:10,电脑用的这几天还算稳定
无***3,2017-03-15 16:03:52,收到宝贝了，电脑很好，卖家还送了很多东西。而且开机速度还挺快的。
我***2,2017-03-15 14:56:31,收到货了，电脑用的确实不错，比想象中的要好好多开机时间0.15秒非常不错，
鄢***5,2017-03-15 13:55:49,电脑收到了用了好几天才来评价的，刚到的时候不会用，客服还远程帮我弄好了，很有耐心的帮我解释
哎***9,2017-03-15 13:15:42,可以，刚开机?，客服很好
苗***子,2017-03-15 12:59:49,用起来会卡 感觉有用过因为我2月底才买的但是2月10号电脑有下载过东西。 卖家说是系统自带的  2900买到这种电脑算可以了
超***8,2017-03-15 12:25:07,很好，买的第二个了，很推荐，
t***0,2017-03-15 10:30:38,本子不错，速度快
z***9,2017-03-15 10:19:17,买的宝贝物美价廉，实用，我目前超喜欢，具体性能状态在以后使用中再追评
爱***己,2017-03-15 10:03:42,帮我弟弟买的，他收到后很喜欢，赞
h***3,2017-03-15 09:14:24,开机速度还算快，用起来手感还不错，本本看起来还是很大气的
张***鹏,2017-03-15 09:05:56,还行吧
风***格,2017-03-15 08:50:19,发热很快，又卡卡的
t***2,2017-03-15 08:45:38,还满意，物流超快，包装也很到位，电脑和想象中的一样
爱***宝,2017-03-15 03:48:39,电脑主频四周外壳比较的松
征***泽,2017-03-15 00:37:23,产品到了好几天了试了一下手感很好！
晨***片,2017-03-15 00:24:07,就那样吧，一般般
z***6,2017-03-14 21:16:19,此用户没有填写评论!
梓***家,2017-03-14 20:48:20,还行，
邓***3,2017-03-14 20:20:14,笔记本使用很流畅，运行一般程序毫无压力，这些配置对学生来说也是够用了。总体来说还是值得购买的。
浩***草,2017-03-14 18:22:23,还不错 就是赠品差个清洁布  总体来说还行    电脑用段时间再说
狂***马,2017-03-14 17:34:04,电脑收到了，这已经是我用的第五台笔记本电脑了，应该说是一台性价比很高的电脑，配置和描述相符合，装的是正版W7的系统，开机20秒左右，鲁大师跑出77018分，看蓝光电影没任何压力，网络连接速度也很稳定，拷贝文件也很快基本满足了我的使用要求。 不过，声音是个硬伤，音量较小，看视频调大又有点破音，这是目前唯一不是很满意的地方。
陈***妤,2017-03-14 16:42:31,电脑死机过一次，玩游戏时有点闪屏
渐***孩,2017-03-14 16:08:39,这个价位真的很不错，服务态度很好哟！可是电脑也好，不卡，开机很快，等过几天我再来追评，目前很喜欢，
g***g,2017-03-14 11:19:51,<b></b>此<b></b>用<b></b>户<b></b>没<b></b>有<b></b>填<b></b>写<b></b>评<b></b>论<b></b>!<b></b>
全***吼,2017-03-14 09:29:18,<b></b>此<b></b>用<b></b>户<b></b>没<b></b>有<b></b>填<b></b>写<b></b>评<b></b>论<b></b>!<b></b>
t***5,2017-03-14 01:32:39,收到了电脑及赠品，电脑，软件均是正品，开机速度超快，连快递员都说屏幕大，有电脑包无线鼠标等性价比超高。w7，w10都可以用！客服态度很好，不厌其烦回答本人的各种困惑。很好的购物体验！
奋***啊,2017-03-13 22:59:01,快递非常快态度也非常好，还有卖家家也非常好我是一个新手有很多不懂，卖家都非常细心的跟我说给老板32个赞。还有电脑也非常好，非常不错哈。
j***8,2017-03-13 22:48:45,机器外观很漂亮，重量刚刚好，超薄，收到货后由于个人使用软件原因，换成win7，速度很不错，就是发票寄得慢了些，到现在才来确认，好评
喜***屋,2017-03-13 22:00:24,还可以 物流很快
吴***0,2017-03-13 21:53:09,全新原装机，用了几天特来评论，售后很负责，客服也很好，
l***y,2017-03-13 21:30:19,总的还可以，就是系统重装了下 送的键盘贴膜对不上 态度还可以 支持国货吗 都给5分
江***1,2017-03-13 21:14:28,性价比高
椰***随,2017-03-13 20:13:35,挺不错的产品，大小合适，各方面都挺满意，就是开始运行的时候有点慢。故意用了这些天才评价。售后，服务不错
j***3,2017-03-13 20:10:31,<b></b>此<b></b>用<b></b>户<b></b>没<b></b>有<b></b>填<b></b>写<b></b>评<b></b>论<b></b>!<b></b>
z***2,2017-03-13 19:31:56,一个字好，两个好，服务也好什么问题都帮你解决
v***n,2017-03-13 19:24:33,产品不多说，就卖家的服务态度必须给个赞
甜***0,2017-03-13 18:51:26,分辨率不是很高&hellip;其他还可以&hellip;
s***n,2017-03-13 18:24:34,<b></b>此<b></b>用<b></b>户<b></b>没<b></b>有<b></b>填<b></b>写<b></b>评<b></b>论<b></b>!<b></b>
w***o,2017-03-13 15:21:56,帮单位同事买的，具体情况还没问，快递速度快，服务态度好，就是发票需要等一个月，总体挺好
甘***宝,2017-03-13 13:23:56,连个按键都没有，难找的要死，还很卡，
s***g,2017-03-13 13:20:02,很好
畅***3,2017-03-13 11:39:50,这台电脑，真的太好了，反应好快啊！价格又便宜，经济性很强，店家发货也很快，我两天就收到了啊！真的是谢谢店家的。
1***4,2017-03-13 10:26:18,开机速度快！物流态度好！旺旺解答快
帅***哥,2017-03-13 09:58:33,电脑用着不错  反应也快  第一次网购这么贵的东西  用了一星期才评论的  确实不错
z***6,2017-03-13 09:37:22,一般吧！要用才知道。
t***妈,2017-03-12 23:40:14,开机15秒，还可以，朋友建议买的。还不错，
叶***瑶,2017-03-12 22:35:37,收到宝贝用了一天&hellip;感觉还行吧&hellip;就是声音有点小
y***0,2017-03-12 22:07:26,货收到了，表示很满意，客服服务也很好，物流也很快
t***4,2017-03-12 21:29:18,非常好。5分
丶***未,2017-03-12 21:23:20,都还行吧，除了键盘膜不怎么配之外。
l***i,2017-03-12 21:01:28,包装特别到位，安全到手。赠品挺多，膜不会贴弄花了，然后又撕下来了。还是原屏幕更舒服。运行挺流畅的，win10还要慢慢适应。
s***3,2017-03-12 20:14:38,总体来说还可以吧内存小点，偶尔花屏习惯性给个好评
无***2,2017-03-12 19:33:59,电脑到货了 游戏玩起来没延迟 看网络直播也可以 看高清视频电影蛮好的
t***9,2017-03-12 17:43:23,宝贝很好，物流也很快，性价比相当高
蜗***5,2017-03-12 14:12:15,东西挺好的，就是w10系统用习惯，鼠标垫无线无线鼠标，键盘膜电脑包都送了，很意外。
青***社,2017-03-12 13:26:24,东西可以，描述的也差不多，客服服务，有问题很乐意解决，我要做一个扣666666的咸鱼！
发***瓜,2017-03-12 12:21:46,不多说啥 买了后自己体会就知道了
龙***6,2017-03-12 11:50:29,运行速度很快，很适合大学生用。客服美美很热心！
双***图,2017-03-12 10:54:59,不错，孩子喜欢 好，善解人意
李***6,2017-03-11 23:44:27,商品质量很好。价格实惠。经济实惠。与店家描述相符合。质量、性能都很好的上等商品，值得再次光临购买。 好评。服务很好。客服认真、负责。绝对的全五星好评。
学***5,2017-03-11 21:58:07,电脑好卡，居然还是win7系统，用着不舒服，和描述的一点也不一样
今***0,2017-03-11 21:18:47,宝贝很好，客服物流都很棒
t***1,2017-03-11 20:25:56,买来用了一段时间，觉得不错值得买，现在才来评论。电脑不错很薄实用。
1***1,2017-03-11 20:22:04,首先声明，我不是卖家的托儿，对电脑也不是小白，可以算是略懂吧，以下是客观评论，仅供参考。  1.总体：我买的套餐三，这是性价比里最合适的一款，鲁大师评分59851，处于中等水平，我推荐这个。2.买时我让卖家装的win7旗舰版，内存占用较小，电脑开机11秒左右。3.CPU和GPU够日常工作和影音娱乐使用，不太吃配置的游戏也挺好，我主要是工作使用，偶尔看看电影，玩玩炉石传说，所以没有问题，要玩大型游戏的话，就用家里的台式机了。4.日常使用CPU温度维持在35左右，非常好，也很安静。5.电池满电正常使用在4-5小时左右。6.键盘按键还可以，但是送的键盘膜跟键盘不配套，有些错位，但不影响正常使用。屏幕不是我喜欢的类型，我喜欢IPS硬屏，这个是镜面屏，可视角度不大，黑屏后能当镜子用。7.笔记本整体塑料材质，但表面采用磨砂毛面处理所以感觉还行。8.笔记本最厚的地方大约为一个5毛硬币的直径比较轻薄。 十四的服务态度很好，我建议把赠品里的单肩包换成双肩，他说尽力，我就没抱太大希望，但拆封的那一刻还是给了我惊喜，真的换成了双肩包，真心不错。送的其他赠品也是够正常使用的，很搭配很实用。
赵***8,2017-03-11 20:19:03,超薄，用的舒适非常的便利，商用本用的不错，下次买电脑这个办公正好
六***问,2017-03-11 18:11:21,电脑不错，加固态内存比实体店便宜，一线品牌，满意的购物。
君***5,2017-03-11 17:58:56,用一段时间感觉性能很赞！
年***萍,2017-03-11 17:32:08,不错，还可以、正用着，后续评价
y***8,2017-03-11 17:29:50,电脑不错，独显，固态+机械，大内存，能想到的都有了，价位这么合适，真是一款性价比超高的本子电脑不错，开机和运行速度都很快，使用了好几天没什么问题，性价比很高，推荐大家购买！
春***5,2017-03-11 16:42:57,总体来说还不错，物流挺快，第三天就收到了，六重好礼也都送了，不过有一点就是感觉风机声音有点大，可能本人对这个声音比较敏感吧。好评！
中***强,2017-03-11 15:31:15,<b></b>此<b></b>用<b></b>户<b></b>没<b></b>有<b></b>填<b></b>写<b></b>评<b></b>论<b></b>!<b></b>
我***渣,2017-03-11 14:42:12,<b></b>此<b></b>用<b></b>户<b></b>没<b></b>有<b></b>填<b></b>写<b></b>评<b></b>论<b></b>!<b></b>
y***7,2017-03-11 13:57:26,质量好，服务态度好，是我们广大客户可以信赖的商家。
胡***5,2017-03-11 13:51:08,拿回来用了几天就开不了机，又拿去升级重装系统，晕死啦！
冷***3,2017-03-11 13:45:07,还不错，总体还行，lol只要网速够能带起来
解***3,2017-03-11 13:25:03,<b></b>此<b></b>用<b></b>户<b></b>没<b></b>有<b></b>填<b></b>写<b></b>评<b></b>论<b></b>!<b></b>
z***了,2017-03-11 12:18:59,发货速度快，电脑运行还可以，包装很好。
翁***清,2017-03-11 12:18:58,物流快，服务好，质量可以。
c***8,2017-03-11 11:00:37,电脑很好用这是第二台电脑了 这次给做的是win7的系统 比10的好用多了 之前的电脑是win10 系统太难用了 这个价格电脑真的挺不错卖家服务挺好
m***达,2017-03-11 10:12:50,三天就到了  还是可以的  外观什么的都可以没有什么损坏的  谢谢快递小哥  十分感谢
1***释,2017-03-11 09:45:30,电脑感觉还可以，这个价钱也感觉不错，希望能用几年，还在用，质量好的话会介绍朋友再次来买的，总体来说一般，但也不是很差。
l***购,2017-03-11 08:44:05,物品和卖家描述一样，就是我这边还没连网，大致挺好的，客服也很好
琳***玥,2017-03-10 23:39:16,宝贝收到啦，快递包装超赞的，顺丰物流也是超给力的，客服也很耐心，谢谢客服宝宝。其实是用了几天再来评价的，宝贝总的来说不错，运行起来也流畅，需要的宝宝别犹豫，下手吧。
流***0,2017-03-10 23:00:03,过来了几天了，今天才开始评价啊！用了下，还可以，就是刚开始玩的时候有点卡，现在还行。
黎***光,2017-03-10 22:06:23,玩游戏太卡，进浏览器也容易卡，还容易自动重启，开机太慢
花***t,2017-03-10 20:07:08,可以
骆***8,2017-03-10 19:00:37,笔记本很好，我对笔记本电脑，说真心话，不懂，亏的客服耐心的指导，谢谢客服，，物流很给力，电脑我用着挺好的
t***6,2017-03-10 18:56:16,联想的牌子是不错的，我试用了3天，各方面的性能都还可以。开机也挺快的，而且还可以插网线，可以放光碟。这是很多电脑都没有的了，电脑散热也是不错的。宝贝我很满意，建议大家购买哦！
小***5,2017-03-10 17:54:16,电脑运用流畅  玩游戏不卡  性价比高  老板人好还送了好多东西
h***o,2017-03-10 16:06:42,我弟弟很喜欢。到时候再追加评价
i***n,2017-03-10 14:41:41,评价晚了，电脑还是很不错的，快递过来包装基本没问题，就电脑本身来说，也算对得起这个价位了，客服也很好，嗯，好评
a***6,2017-03-10 14:39:16,电脑收到一个多星期了用起来很不错就是w10的系统用的不是很习惯，用了几天就熟悉了 客服也很给力赠送的贴膜  鼠标屏幕清洗剂  键盘膜都是很高的性价比  值得购买
d***8,2017-03-10 14:29:19,做为日常办公来讲，配置很很高，性价比很好啊！系统非常迅速。赠送的包也很好
化***使,2017-03-10 14:14:17,还是挺不错的，用着不卡
声***9,2017-03-10 13:59:27,东西不错，开机给力，客服很到位，东西都给装了，很满意的一次购物
猕***挚,2017-03-10 13:52:07,好用
t***2,2017-03-10 13:19:23,电脑很轻薄，屏幕不错15.6清晰度还可以，键盘按键手感很好静音效果不错，加装SSD启动就是快，赠送的礼品特别是鼠标挺好用的小巧。
我***忆,2017-03-10 12:56:19,首先物流给力，其次送的东西很实用，最后就是本店的电脑真的很好用。客服很贴心，我问了许多问题，客服都是耐心回答的。有需要的小伙伴们值得拥有。
w***y,2017-03-10 12:34:33,电脑用过了几天时间了，还不错，卖家态度特别好，外观也是挺不错的！有什么问题他都及时解决，值得购买！
周***素,2017-03-10 12:22:25,物流快，电脑刚拿到，目前还可以
w***i,2017-03-10 11:21:41,电脑不错，运行快，以前喜欢用电视看，现在喜欢用电脑看了，电视老卡，还是电脑方便，哈哈
t***9,2017-03-10 11:16:03,很喜欢?
d***1,2017-03-10 08:14:48,电脑用着还不错速度挺快的
d***我,2017-03-10 07:59:15,电脑是用来办公用的，同事反应很好，开机快。发票很及时的寄出。谢谢卖家。
盛***蛾,2017-03-09 21:09:38,电脑美观，性能不错，店里送的东西比较齐全，电脑不卡，音质画质都可以，货真价实。
l***1,2017-03-09 20:05:38,试用了几天感觉不错? 综合评价比较好，客服也比较好，希望使用愉快
陈***4,2017-03-09 19:54:20,很不错，物流很快，连wifi一点都不卡，手机也连，手机慢，它也不慢。
稀***8,2017-03-09 18:54:21,宝贝特别好，信价比很高，开机快，内存大，反应迅速，玩游戏也特别棒！
q***1,2017-03-09 18:40:48,用了几天感觉电脑很不错，很轻便，用起来也顺手，总得来说值这价，送的东西也很好。
琵***开,2017-03-09 18:07:04,看图说话，有图有真相。。这个价挺实惠的，，电脑也好看。。个人觉得还不错。以后追剧没烦恼啦
往***吗,2017-03-09 17:34:58,电脑回来了，用了几天感觉很不错，客服也很好，态度非常好，服务很周到。值得信赖。
骆***贝,2017-03-09 16:33:04,电脑确实好用，反应比较快，对于我这样只是看电影，网页足够了，卖家服务态度够耐心，寄过来的赠品没有贴膜和卖家沟通后也给我答复了，必须好评
t***6,2017-03-09 14:37:11,屏幕合适，看着舒服，全黑色我也很喜欢送的东西也很齐全
l***1,2017-03-09 14:21:28,了几天，还可以
b***4,2017-03-09 13:44:44,开机速度快，运行稳定，屏幕超大，轻便实用，价格不贵，随手带方便，电力耐用
x***7,2017-03-09 12:08:08,不错
—***智,2017-03-09 11:51:34,很有耐心的教我谢谢了
m***1,2017-03-09 11:48:46,东西挺好的，要的软件卖家也给下载好了，挺好的一次购物，赞一个吧，
j***5,2017-03-09 10:12:23,网上找了好久，这款的性价比最高，平常就是看看股票，发货快，包装完好，机子用了几天，没啥毛病！
无***应,2017-03-09 09:27:39,还行
t***1,2017-03-09 08:30:04,物流很快，第二天就收到了，用的顺丰，还送了六样礼物，挺不错的，用了之后再来评价。
w***1,2017-03-09 08:16:56,不错
5***灵,2017-03-08 21:21:43,整体来说还是不错的～试用了一个星期才来评的  给好评吧
总***9,2017-03-08 21:04:43,这个电脑这个价格好值开机好快上网不卡不错真心好
t***1,2017-03-08 20:37:15,货已收到，挺好的
l***0,2017-03-08 20:36:57,挺快的，用着还不错，价格比店里便宜
莫***忆,2017-03-08 20:02:13,抱歉，这两天太忙了。忘记评价了。电脑真的很不错，一点也不卡
挥***你,2017-03-08 19:56:20,怎么说呢？一分价钱一分货吧？这个价钱挺对得起这个电脑啦！毕竟在实体店需要5000多呢？然后用着挺流畅的，但是就是在开机的时候有一点点小小的阻碍，不妨碍，大家的使用，这个电脑挺不错的啦！你再挑再怎么调再怎么，这个价位已经对得起这个电脑有些人会说这个电脑怎么怎么样，但是价位在这，然后我们的客服也很好，她们就说会给我们处理一些问题呀！然后也非常的热情。
杨***5,2017-03-08 19:09:21,电脑真的是卡AMD的机子果然 反正不玩游戏 这个价位无所谓了！ 现在先用着 过两天再来看后续情况！
爽***6,2017-03-08 15:56:44,很喜欢！比想象中的要好很多！物流很给力！总之很喜欢，用了一会，还算好用，不知能用多久?很喜欢！
神***我,2017-03-08 15:51:15,用了几天才来评价，性能还不错很稳定，屏幕大，做文件设计，随身携带很方便。
f***6,2017-03-08 14:09:50,电脑很好，不卡，还送了礼品，老公非常满意！ 好评
p***8,2017-03-08 13:56:20,用了几天了，主要是办公用，效果还是不错的，性价格比较高！ 绝对到位
卓***伟,2017-03-08 13:43:11,不错哦。总体可以了。卖家很热心
t***5,2017-03-08 12:53:23,功能反应各方面能满足，老板爽快待客好
听***空,2017-03-08 12:17:14,特地用了7天才来评论，跑分五万多，插电源开机13到15秒，不带电源开机40多秒，看电影玩游戏CPU温度一直四十多℃，挺不错的。缺点是电池不可卸，USB接口只有两个，无法运行WiFi共享精灵等WiFi共享软件（也可能是我不会用），试过一次开机就死机，并且重启失败，最终强制关机解决。
h***g,2017-03-08 12:05:57,好评整体还不错
t***5,2017-03-08 11:44:24,联想笔记本就是好，薄，轻。加装固态硬盘后开机10秒，反应快。使用了一天，个人感觉此本本好，好好！希望一直都好！
青***9,2017-03-08 11:22:15,电脑收到了是正品，运行速度还可以，玩游戏也不卡，目前状态良好
好***鹿,2017-03-08 10:10:14,昨天收到的货，物流还是很快的，前天拍昨天就到了，还是很好的，用了一下没什么问题
大***8,2017-03-08 10:09:42,中国好卖家，质量服务第一
t***2,2017-03-08 10:06:49,实物与描述基本一致。
露***w,2017-03-08 09:53:55,电脑到手一个星期了，主要是想试一下性能，不过性价比还是蛮高的，店家用顺丰寄的快递，速度还是蛮快的
